Product URL,Product Name,Product Price,Rating,Number of Reviews,availability,ASIN,Product Description,Manufacturer
https://www.amazon.in/uppercase-Professional-resistant-sustainable-Anti-theft/dp/B0BR5NDW4N,"uppercase SealPro Professional Laptop Backpack (15.6 Inch) 3x more water resistant sustainable bags with rain proof zippers & Anti-theft for Men, Women, Boys and Girls, 750 Days warranty","₹1,900",69 ratings,4.6 out of 5 stars,In stock,B0BR5NDW4N,No Description,Visit the uppercase Store
https://www.amazon.in/Zebronics-Compartment-Backpacks-15-6-inch-Black/dp/B0C6KZS555,"Zebronics Camp1, 14 Liters, 1 Compartment Laptop Backpacks Fit Up to 15.6-inch Laptop, Polyester Fabric, Office Use and Mini Business Travel Bags (Black)",₹499.00,,Previous page,In stock,B0C6KZS555,"Zebronics Camp1, 14 Liters, 1 Compartment Laptop Backpacks Fit Up to 15.6-inch Laptop, Polyester Fabric, Office Use and Mini Business Travel Bags",Visit the ZEBRONICS Store
https://www.amazon.in/Gear-Black-Orange-Laptop-Backpack/dp/B0B4S7CXYQ,Gear ECO 1 Black Orange Red Laptop Backpack,₹879,"1,398 ratings",4.3 out of 5 stars,In stock,B0B4S7CXYQ,No Description,Brand: Gear
https://www.amazon.in/F-Gear-Hunter-Bkgy-Diamond/dp/B09V5JLV5H,"F Gear Hunter 75 Ltrs Black Rucksack (Black, Grey Diamond)","₹1,890.00","1,968 ratings",4.2 out of 5 stars,In stock,B07DCDTL21,This immaculate and flawless hiking bag by f gear has many features and functions. reflective printing along with inbuilt rain cover in a concealed pocket makes it most adapted for rainy conditions. it has a soft shell that is brilliant and soothing of the skin. the bag is equipped with a butterfly lock. it has hip belt for strong support and a helmet compartment for storing and carrying the helmet. the hiking bag has two kinds of locks. one is a butterfly lock and the other is a drawstring lock. the bag has a sturdy handle strap and a padded strap type. it has an adjustable shoulder strap. ladder lock allows you to adjust and lock the straps depending on your height for improved comfort. this hiking bag is an excellent travel gear. it has expandability. the bag can be enlarged. other features the drawstring closure of this stylish and trendy bag ensures ease and finesse. Material : Polyester,Visit the F Gear Store
https://www.amazon.in/Stylish-Casual-Backpack-Laptop-College/dp/B07GXZPTRD,DZert Clasy Laptop Bag College Bag for Boys Girls 21 L Nevy Blue,₹339.00,"2,496 ratings",3.8 out of 5 stars,In stock,B07H1BPCGQ,No Description,Visit the DZert Store
https://www.amazon.in/Fast-Travel-partition-Collage-Backpack/dp/B09VCP93GJ,"Fast Travel 45 Ltrs, 46 cms School Bag Class 5-12 Large 4 partition Laptop Collage Office Travel Backpack Unisex",₹692,947 ratings,4.1 out of 5 stars,In stock,B09VCP93GJ,"A Sporty Versatile School Laptop Collage Office Backpack From Fast Travel, Made Of Polyester. It Has a 3 opening Compartment & 2 For quick & easy access to essential While the mesh padding on the back panel will feel comfortable, even on a hot day. Stylish And Durable Backpack For Office School /College And Travel. Easily Accommodate A Laptop. Size: 46 Cm X 33 Cm X 20 Cm.",Brand: Fast Travel
https://www.amazon.in/Lenovo-Professional-Backpack-Water-resistant-Uncompromised/dp/B08R7S55H4,"Lenovo 15.6"" Professional Backpack, Made in India, Water-resistant,Uncompromised storage, Travel friendly:Fleece-lined PC compartment,Vented,Padded BackPanel & Adjustable shoulder straps,Luggage strap",₹701,908 ratings,4.2 out of 5 stars,In stock,B0BC6W5HBN,No Description,
https://www.amazon.in/TRUE-HUMAN-Anti-Theft-backpack-combination/dp/B09VCHV6T5,"TRUE HUMAN® Emperor Anti-Theft backpack with combination lock Laptop bag,office bag for Men and Women | College Bags for Girls & Boys (Zyden)",₹675,"1,172 ratings",3.7 out of 5 stars,In stock,B09VCHV6T5,No Description,Visit the TRUE HUMAN Store
https://www.amazon.in/EUME-Tourismo-Backpack-Resistance-15-6-inch/dp/B0B4JQSMD5,EUME Tourismo 36L Laptop Backpack Bag with 2 Large Compartment for Work Office & Business Travel for Men & Women | Water Resistance | Fit Up to 16 Inch Laptop,"₹2,499",7 ratings,4.4 out of 5 stars,In stock,B0BB2V2NFB,No Description,Visit the EUME Store
https://www.amazon.in/Elegant-Waterproof-Backpack-College-Business/dp/B0C6Y2Q5ZV,Elegant 16 inch 28 L Casual Waterproof Laptop Backpack/Office Bag/School Bag/College Bag/Business Bag/Unisex Travel Backpack,₹899,5 ratings,5.0 out of 5 stars,Only 4 left in stock,B0C6Y2Q5ZV,No Description,Brand: Elegant
https://www.amazon.in/Sirona-Sanitary-Napkin-Diapers-Disposal/dp/B01NAZVN8M,"Sirona Sanitary Disposal Bags | 75 Bags | Pad Disposable Bags for Discreet Disposal of Tampons, Condoms, Diaper, Sanitary Pads, Panty Liner & Personal Hygiene Waste (Green)",₹211.00,"2,922 ratings",4.5 out of 5 stars,In stock,B01NAZVN8M,"Now Bigger & Better! Worried about disposing your Sanitary & Intimate Products? Made in India, 'I Love Clean' by SIRONA are Cute Oxo BioDegradable Disposable Sanitary Bags & are best for Hygienic Disposal of Intimate Care Products (Sanitary Pads, Tampons, Panty Liners, Baby Diapers, Condoms, PeeBuddy) or General products (which need discreet disposal). No More Black Plastic Bags, No More Newspaper. Now use I LOVE CLEAN. The bags are tear resistant and seal perfectly to ensure zero bad odour or leakage.",Visit the Sirona Store
https://www.amazon.in/POLICE-Backpack-Casual-College-Polyester/dp/B0BHNJK832,POLICE Backpack for Men Casual Laptop Bag Office/Travel/College 30 Ltr Hedge Polyester - Black,"₹1,399","5,735 ratings",4.1 out of 5 stars,In stock,B0BHNJK832,Backpack,Visit the POLICE Store
https://www.amazon.in/BetterShine-Printed-Capacity-Waterproof-Compartment/dp/B0CC2X1ZJR,BetterShine Floral Printed Stylish Bag With 25 Litre Capacity Waterproof With Laptop Compartment,₹699,,Previous page,In stock,B0CC2X1ZJR,"We Presents Printed Stylish Backpack for Boys And Girls with Standard Size and Suitable in All Places and Made by Strenthen Material Polyster Waterproof . And Useful For College ,School , Kids , Coaching Purpose Etc. Best Comfortable For in All Condition.Pen Pocket and Card Pocket Available. Laptop Compartment Also Available.",Brand: BetterShine
https://www.amazon.in/Wildcraft-Typo_Blu-Casual-Backpack-11619-Typo_Blu/dp/B079DDV3JD,Wildcraft 35 Ltrs Casual Backpack (11619-Blue),"₹1,298.00",234 ratings,4.2 out of 5 stars,In stock,B079DDV3JD,"Two compartment for better organisation, side fabric pocket for carrying a bottle, padded back system for better back support, padded shoulder straps for comfort, ease of carrying, quick-grab haul loop, quick-access, flat front pocket to store basic essentials, multi-level organiser for storing accessories.",Brand: Wildcraft
https://www.amazon.in/Glowic-Hopping-Shoulder-Handbags-WBAG-34/dp/B09HHNZ47K,"Glowic Hopping Grocery, Travel, Beach | Shoulder Handbags Women, College Bags for Girls Stylish Trendy(WBAG-34) (Multi Colour)",₹459,432 ratings,3.7 out of 5 stars,In stock,B09HHNZ47K,"GLOWIC presents an range of chic, stylish and classy bags. Perfect Look: Designed for the modern woman, we use a variety of trendy and traditional prints that make you and your bag stand out in the crowd. Colourful: Classic colour combinations as well as mix and match of hip patterns make these bags ideal for any occasion. Occasion: be it work, college,travel, event or a party, there is a perfect bag for everything and everyone. Long Lasting: Comfortable and Spacious, light to hold and long lasting, our line of fashionable sling bags and totes are a must have in any wardrobe Available in beautiful prints, eye catching embroidery and brilliant colours, our bags complement your clothes and accentuate your accessories.Available in beautiful prints, eye catching embroidery and brilliant colours, our bags complement your clothes and accentuate your accessories.",Visit the Glowic Store
https://www.amazon.in/Impulse-rucksack-backpack-trekking-Warranty/dp/B09TDN3N1K,Impulse rucksack bags 60 litres travel bag for men tourist bag for travel backpack for hiking trekking Bag for men camping thames blue bag with 1 Year Warranty,₹999,340 ratings,3.9 out of 5 stars,In stock,B09TDN3N1K,No Description,Brand: Impulse
https://www.amazon.in/Tabelito%C2%AE-NEO-Resistant-Business-Notebook/dp/B0C2D3DRW5,"Tabelito® NEO 3O L Water Resistant Laptop/College/Office/School/Travel/Business Bag, Unisex Backpack for Men Women Fits Up to 15.6 Inch Laptop Notebook.",₹399,104 ratings,3.9 out of 5 stars,In stock,B0C2D3DRW5,"Decent BACKPACK: The Tabelito Backpack / Daypack is made of HIGH QUALITY Anti Scratch Fabric with a sturdy zipper design, making it incredibly sturdy, tear-resistant, and capable of protecting your items from dust, rain, and filth. Even more robust and long-lasting are the strong buckle and zipper. LARGE CAPACITY & MULTI COMPARTMENTS & LIGHT WEIGHT: The backpack has three compartments. There is ample storage for clothes, books, a lunchbox, daily needs, and tech equipment accessories in the separate laptop compartment that fits a 15.6-inch laptop as well as a 15-inch, 14-inch, and 13-inch or Mac book. The middle compartment has enough capacity for a laptop charger, an iPad, a tablet, a smartphone, a document file, and other necessary accessories. There are two small elastic mesh side pockets for water bottles and a front compartment with zipper pockets for easy access items like a mask, wallet, metro card, and wallet. Make your goods more accessible and organised. HIGH QUALITY MATERIAL: The metal zippers on our backpack are made of high-quality, water-resistant Polyester fabric. Lightweight and strong build guarantee daily use that is safe and durable. Perfect for shopping, office work, business travel, weekend trips, and other outdoor activities. It is also the ideal backpack for teens, boys, girls, adults, and other genders.",Visit the Tabelito Store
https://www.amazon.in/Classic-Leather-Laptop-Backpack-LBPCLSLTH0101/dp/B09ZLKXGMQ,Gear Classic 20L Faux Leather Water Resistant Anti Theft Laptop Bag/Backpack for Men/Women-Black,₹979.00,"2,708 ratings",4.4 out of 5 stars,In stock,B07G4D13LB,No Description,Visit the Gear Store
https://www.amazon.in/Gizga-Essentials-Organizer-Multi-Utility-Cosmetics/dp/B09WVRKYCJ,"Gizga Essentials Travel Toiletry Kit Bag for Men & Women, Travel Organizer Case with Handle & Hook, Premium Zipper, Multiple Pockets, Multi-Utility Pouch for Shaving Makeup Cosmetics, Light Grey",₹349.00,161 ratings,4.2 out of 5 stars,In stock,B09WVRKYCJ,No Description,Visit the GIZGA essentials Store
https://www.amazon.in/Wildcraft-Hopper-Laptop-Backpack-Blue/dp/B07YNL6H8H,Wildcraft Hopper 1.0 Laptop Backpack 24L (Blue),"₹1,390",8 ratings,4.5 out of 5 stars,In stock,B07YNL6H8H,This Laptop Backpack ha capacity of 24 L. This comes in blue colour.,Brand: Wildcraft
https://www.amazon.in/AmazonBasics-Ltrs-Large-Duffel-Bag/dp/B09MJ96GNY,AmazonBasics Nylon 43 Cms Travel Duffle Bag (Red),"₹1,727.00","6,828 ratings",4.3 out of 5 stars,In stock,B01GGNW5AM,"AmazonBasics 98 Ltrs Large Duffel Bag, Red",Brand: amazon basics
https://www.amazon.in/WALKENT-Waterproof-Laptop-Pockets-Cushioned/dp/B0CC5SRCP8,"WALKENT Waterproof Laptop Bag for Men with Side Bottle Pockets, Cushioned Straps & More P3","₹4,990",,Previous page,Only 4 left in stock,B0CC5SRCP8,"WALKENT Waterproof Laptop Bag for Men with Side Bottle Pockets, Cushioned Straps & More P3",Visit the WALKENT Store
https://www.amazon.in/Number-Backpack-Compartment-Charging-Organizer/dp/B09VTBYNHF,"FUR JADEN Anti Theft Number Lock Backpack Bag with 15.6 Inch Laptop Compartment, USB Charging Port & Organizer Pocket for Men Women Boys Girls",₹679,"4,921 ratings",4.0 out of 5 stars,,B09VTBYNHF,"Stay organized all day with a durable and lightweight backpack from Fur Jaden. This back pack is a stylish and functional accessory for men and women. Can add admiration to an appealing and daring personality with a remarkable aesthetics and functionality. This backpack features an anti-theft design. You can also charge your phone on the go and organize your stuff like pro. Fur Jaden functional back pack is apt to protect your gadgets and belongings from being stolen while you travel, thanks to its special anti-theft design. Now keep your belongings safe with style. The backpack features multiple compartments that you may use for your laptop and other essentials. A remarkable feature of this backpack allows you to charge your phone while you are on the move. With an attached charging dock in the back you may connect a portable power bank with ease. Weighing about 600grams, this backpack is lightweight. The backpack is able to house a laptop of up to 15.6 inches and has seven inner compartments to place your other essentials. Made from durable quality polymer this Fur Jaden back pack is sturdy and reliable. Flaunt this bag with style and low maintenance as this bag is washable. This backpack is also suitable for school or college. The straps are designed to distribute the weight equally on each shoulder preventing any sort of discomfort. Use this back pack for office, college/school or during travels.",Brand: FUR JADEN
https://www.amazon.in/MuscleBlaze-Duffle-Women-Sports-Weekender/dp/B0CB6LRWNS,"MuscleBlaze Gym Duffle Bag for Women and Men, Sports Bag, Weekender Bag, Black, 30 L",₹449.00,4 ratings,5.0 out of 5 stars,In stock,B0C8BBNB8B,MuscleBlaze Gym Duffle Bag - Great for Life On The Go!,Visit the MuscleBlaze Store
https://www.amazon.in/MOKOBARA-TSBPK12CND22001-The-Backpack/dp/B098R8VHJN,"MOKOBARA Backpack 15.5"" Inch Laptop Backpack For Women (16 litres ) Improved (2022 - Model)","₹4,799",191 ratings,4.3 out of 5 stars,In stock,B098R8VHJN,No Description,Visit the MOKOBARA Store
https://www.amazon.in/Lavie-Womens-Sling-Ladies-Handbag/dp/B0CC9SCTP1,Lavie Women's Sara Box Sling Bag | Ladies Purse Handbag,₹812,"1,879 ratings",4.0 out of 5 stars,In stock,B0CC9SCTP1,No Description,
https://www.amazon.in/NORTH-ZONE-Waterproof-Backpack-Dimensions/dp/B0BW97JGNZ,NORTH ZONE Casual Waterproof Laptop Backpack/Office Bag/School Bag/College Bag/Business Bag/Travel Backpack (Dimensions:13x18 inches) (Compatible with 39.62cm(15.6inch laptop) 30 L (Blue & black),₹486,2 ratings,4.5 out of 5 stars,In stock,B0BW97JGNZ,"A sporty versatile Backpack from Northzone. It has a top opening compartment for quick & easy access to essentials while the mesh padding on the back panel will feel comfortable, even on a hot day. This backpack can be carried in 2 ways as it has an additional front handle to hold it in case you’re unable to carry it on your back.",Brand: NORTH ZONE
https://www.amazon.in/Gear-Green-Casual-Backpack-BKPECOBP40503/dp/B019HA8DQQ,Gear Eco4 18L Water Resistant School Bag//Backpack/College Bag for Men/Women - Navy Blue,₹498,"4,258 ratings",4.0 out of 5 stars,In stock,B019HA8DQQ,"Intuitively crafted at the Gear design studio to balance comfort, style, endurance and functionality.",Visit the Gear Store
https://www.amazon.in/Wildcraft-Typo_Blk-Casual-Backpack-11619-Typo_Blk/dp/B079MBFH5V,Wildcraft 35 ltrs (19 Cms) Casual Backpack(11619-Typo_Blk_Black),"₹1,395.00",397 ratings,4.1 out of 5 stars,In stock,B079MBFH5V,"Two compartment for better organisation, side fabric pocket for carrying a bottle, padded back system for better back support, padded shoulder straps for comfort and ease of carrying, quick-grab haul loop, quick-access, flat front pocket to store basic essentials, multi-level organiser for storing accessories.",Brand: Wildcraft
https://www.amazon.in/Convertible-Backpack-Messenger-Briefcase-Multi-functional/dp/B09L82LLRZ,COSMUS Agility Convertible Backpack Messenger Bag Shoulder bag Laptop Case Handbag Business Briefcase Multi-functional Travel Bag Fits 15.6 Inch Laptop,"₹2,255",965 ratings,4.2 out of 5 stars,In stock,B09L82LLRZ,No Description,Visit the COSMUS Store
https://www.amazon.in/Fur-Jaden-Waterproof-Resistant-Backpack/dp/B09M84TYVM,FUR JADEN Vegan Leather 30L 15.6 Inch Laptop Backpack for Men Women for Office Professionals and College Students Brown,₹839.00,"2,319 ratings",4.2 out of 5 stars,Available to ship in 1-2 days,B07P5X6NSN,A trendy addition to your accessory collection this season comes in the form of this Backpack,Brand: FUR JADEN
https://www.amazon.in/Safari-Laptop-Backpack-Resistant-Fabric/dp/B09B25Z8M2,Safari Quill Large Laptop Backpack 26 Ltrs Water Resistant Fabric - Black,₹899,971 ratings,3.9 out of 5 stars,In stock,B09B25Z8M2,"Safari Quill is a 26 Litres, 2 compartment laptop backpack perfect for daily usage. It has a dedicated tech safe laptop sleeve that can hold upto 17 inch laptop or any smaller ones easily. The laptop sleeve is also fully padded from the bottom protecting your device from any shock or damage. This backpack is especially designed for todays fast paced world, where everything should be compact and lightweight. This backpack is perfect for everyday usage such as college, school, tuitions, or short holiday trips. The front pocket is designed to keep your essentials organized and side mesh pockets are perfect for storing your water bottle and umberella. Made of high grade water resistant polyester fabric, this backpack will last you several trips.",Visit the Safari Store
https://www.amazon.in/Safari-Laptop-Backpack-Resistant-Fabric/dp/B09B28TKLG,Safari Quill Large Laptop Backpack 26 Ltrs Water Resistant Fabric - Blue,₹899,712 ratings,4.0 out of 5 stars,In stock,B09B28TKLG,"Safari Quill is a 26 Litres, 2 compartment laptop backpack perfect for daily usage. It has a dedicated tech safe laptop sleeve that can hold upto 17 inch laptop or any smaller ones easily. The laptop sleeve is also fully padded from the bottom protecting your device from any shock or damage. This backpack is especially designed for todays fast paced world, where everything should be compact and lightweight. This backpack is perfect for everyday usage such as college, school, tuitions, or short holiday trips. The front pocket is designed to keep your essentials organized and side mesh pockets are perfect for storing your water bottle and umberella. Made of high grade water resistant polyester fabric, this backpack will last you several trips.",Visit the Safari Store
https://www.amazon.in/Sirona-Sanitary-Napkin-Diapers-Disposal/dp/B01NAZVN8M,"Sirona Sanitary Disposal Bags | 75 Bags | Pad Disposable Bags for Discreet Disposal of Tampons, Condoms, Diaper, Sanitary Pads, Panty Liner & Personal Hygiene Waste (Green)",₹211.00,"2,922 ratings",4.5 out of 5 stars,In stock,B01NAZVN8M,"Now Bigger & Better! Worried about disposing your Sanitary & Intimate Products? Made in India, 'I Love Clean' by SIRONA are Cute Oxo BioDegradable Disposable Sanitary Bags & are best for Hygienic Disposal of Intimate Care Products (Sanitary Pads, Tampons, Panty Liners, Baby Diapers, Condoms, PeeBuddy) or General products (which need discreet disposal). No More Black Plastic Bags, No More Newspaper. Now use I LOVE CLEAN. The bags are tear resistant and seal perfectly to ensure zero bad odour or leakage.",Visit the Sirona Store
https://www.amazon.in/POLICE-Backpack-Casual-College-Polyester/dp/B0BHNJK832,POLICE Backpack for Men Casual Laptop Bag Office/Travel/College 30 Ltr Hedge Polyester - Black,"₹1,399","5,735 ratings",4.1 out of 5 stars,In stock,B0BHNJK832,Backpack,Visit the POLICE Store
https://www.amazon.in/Number-Backpack-Compartment-Charging-Organizer/dp/B09VTBYNHF,"FUR JADEN Anti Theft Number Lock Backpack Bag with 15.6 Inch Laptop Compartment, USB Charging Port & Organizer Pocket for Men Women Boys Girls",₹679,"4,921 ratings",4.0 out of 5 stars,,B09VTBYNHF,"Stay organized all day with a durable and lightweight backpack from Fur Jaden. This back pack is a stylish and functional accessory for men and women. Can add admiration to an appealing and daring personality with a remarkable aesthetics and functionality. This backpack features an anti-theft design. You can also charge your phone on the go and organize your stuff like pro. Fur Jaden functional back pack is apt to protect your gadgets and belongings from being stolen while you travel, thanks to its special anti-theft design. Now keep your belongings safe with style. The backpack features multiple compartments that you may use for your laptop and other essentials. A remarkable feature of this backpack allows you to charge your phone while you are on the move. With an attached charging dock in the back you may connect a portable power bank with ease. Weighing about 600grams, this backpack is lightweight. The backpack is able to house a laptop of up to 15.6 inches and has seven inner compartments to place your other essentials. Made from durable quality polymer this Fur Jaden back pack is sturdy and reliable. Flaunt this bag with style and low maintenance as this bag is washable. This backpack is also suitable for school or college. The straps are designed to distribute the weight equally on each shoulder preventing any sort of discomfort. Use this back pack for office, college/school or during travels.",Brand: FUR JADEN
https://www.amazon.in/ASUS-VP4700-Backpack-Reflective-Suitable/dp/B0937G637K,"ASUS TUF Gaming VP4700 46.5 cm X 30.0 cm X13.0 cm Backpack (Black), with Roll-Up Design, Reflective Logo, Suitable for up to 46.5 cm Laptop","₹1,999.00",93 ratings,4.1 out of 5 stars,In stock,B0937G637K,"Entry gaming Flexible key feature sets for maximum maximum TA to reach entry gaming sector. With life style design, we could bring in TUF element and image into young generation and make exposure everywhere.",Visit the ASUS Store
https://www.amazon.in/Hammonds-Flycatcher-Original-Expandable-Messenger/dp/B0849X3NMJ,"Hammonds Flycatcher Genuine Leather Laptop Bag for Men/Office Bag for Men, Brown | Fits Upto 16"" Laptop/MacBook| Bag with Shoulder Straps | Laptop Messenger Bag/Leather Bag for Men with Trolley Strap","₹4,296.00","2,719 ratings",4.4 out of 5 stars,In stock,B06ZYQCG92,No Description,Visit the HAMMONDS FLYCATCHER Store
https://www.amazon.in/HYDER-Seamless-Waterproof-Lightweight-Backpack/dp/B0BJ6Q26Y2,HYDER Kids 20L Seamless Printed Cartoon Best Stylish Waterproof Lightweight Casual/Picnic/Tuition/School Bag/Backpack for Children Boys And Girls,₹518,366 ratings,4.1 out of 5 stars,In stock,B0BJ6Q26Y2,No Description,Visit the HYDER Store
https://www.amazon.in/Cosmetic-Bags-Women-Aesthetic-Organizer/dp/B0C77ZN924,Cosmetic Bags for Women - Corduroy Cosmetic Bag Aesthetic Women Handbags Purses Smile Dots Makeup Organizer Storage Makeup Bag Girls Case Bags Capacity Canvas Makeup Bags (Beige),₹259.00,,Previous page,In stock,B0C77ZN924,"Inralimot Makeup Bag Cosmetic Pouch Cosmetic Bag for Women and Girls. Inralimot Makeup Bag Cosmetic Pouch Cosmetic Bag for Women and Girls. Size:10*7*2 inch Weight: 3 Ounce Material:corduroy,canvas,cotton cosmetic bag small makeup bag makeup bags small cosmetic bag skincare bag pouches for organization makeup bag small purse makeup bag cosmetic bag medium makeup bag makeup bag for purse compact makeup bag makeup carriersmall capacity storage bag. Easy To Carry:students,girls, women for travel, business, home ,items organizer. Zipper closure that securely keeps the bag closed and prevents your items from falling out. Foldable, portable,washable and lightweight. Perfect for travel,vacation,business trip,gym,camping,bathroom organization, not only it is a simple zipper bag, but also it is a functional makeup bag, cosmetic bag, travel organizer bag of your cosmetic tools. You can use them for a long time.",Brand: Inralimot
https://www.amazon.in/Genie-Clara-Backpack-Women-compartments/dp/B097JJGR1N,"Genie Clara Backpack for Women - 3 compartments, Laptop Bags for Girls, Stylish and Trendy College Backpacks for Girls, Water Resistant and Lightweight Bags for Office and Travelling Purpose.","₹1,279",194 ratings,4.4 out of 5 stars,In stock,B097JJGR1N,"How do you describe a Perfect School Backpack? Spacious enough to carry all the books, yet Light Weight! Padded Laptop Sleeve to keep it secure and sound. Multiple Pockets to segregate all the items and keep it easily accessible. An Organizer to keep your each and every school supplies in an arranged manner. Side Pocket to keep the Water Bottle. Water Resistant exteriors to keep all your worries at bay and lastly, latest and trendy design to keep those ""Cute Bagpack"" compliment coming in! Yes. We have that Perfect Bag for you, in our Genie store. Bringing you a cute, stylish and trendy design, Genie Clara School Bag.",Visit the Genie Store
https://www.amazon.in/Wildcraft-Turnaround-Polyester-Laptop-8903340000000/dp/B012D4QWES,Wildcraft Turnaround Polyester 14 inch 27 Ltrs Blue Laptop Bag (8903340000000),"₹1,775","3,327 ratings",4.3 out of 5 stars,In stock,B012D4QWES,The durable Peza workpack is designed for travel enthusiasts. It perfectly organizes your belongings and comes with a specially designed padded back system for enhanced carrying comfort. Laptop Compatible: Fits up to 15.4 laptop ; Quick-access side mesh pocket ; Ventex back system allows ventilation and better airflow.,Brand: Wildcraft
https://www.amazon.in/Gear-Expandable-RainCover-Grey-Black-TLPTURBO00401/dp/B097KDRZ67,Gear Turbo 45L Expandable Water Resistant Antitheft Laptop Bag/Backpack/Briefcase For Men/Women With Raincover (Grey),Page 1 of 1,"1,062 ratings",4.4 out of 5 stars,Not Available,B097KDRZ67,"Gear bags are designed for the quick commute as well for the long journey. These backpacks can be used as laptop bags, adventure bags and so on. Your favorite travel companion, the backpacks come with enough storage space to carry all your requirements.",Visit the Gear Store
