Product URL,Product Name,Product Price,Rating,Number of Reviews,availability,ASIN,Product Description,Manufacturer
https://www.amazon.in/Genie/dp/B09MJ9PNQZ,"GENIE Miami Casual Backpacks for Women, 14 inch, Stylish and Trendy College backpacks for girls, Water Resistant and Lightweight Mini Bags Latest collection (Rose)",₹749,"2,197 ratings",4.2 out of 5 stars,In stock,B09MJ9PNQZ,"Bring your A game with the Genie Miami Midnight backpack. A perfect fusion of prints, structure and design, this backpack is feather light and fully lined for extra strength. It has a spacious compartment with a zipper opening and a side pocket for easy access.",Visit the Genie Store
https://www.amazon.in/WALKENT-Waterproof-Laptop-Pockets-Cushioned/dp/B0CC5SRCP8,"WALKENT Waterproof Laptop Bag for Men with Side Bottle Pockets, Cushioned Straps & More P3","₹4,990",,Previous page,Only 4 left in stock,B0CC5SRCP8,"WALKENT Waterproof Laptop Bag for Men with Side Bottle Pockets, Cushioned Straps & More P3",Visit the WALKENT Store
https://www.amazon.in/Backpack-Business-Backpacks-Charging-Resistant/dp/B094DGSWH3,"FUR JADEN Travel Laptop Backpack, Business Backpacks with USB Charging Port, Water Resistant College School Computer Bag for Men & Women Fits Under 15.6 inch Laptop and Notebook",₹949,481 ratings,4.3 out of 5 stars,In stock,B094DGSWH3,No Description,Brand: FUR JADEN
https://www.amazon.in/HP-15-6-inch-Backpacks-Pass-Through-793A6AA/dp/B0BYDXVM5Q,HP 320 15.6-inch Backpacks/Trolley Pass-Through; Padded Back Panel; Padded air mesh Panel/Hand wash and air Dry/Padded Laptop Pocket/1 Year Limited Warranty (793A6AA),"₹1,217.00",17 ratings,3.7 out of 5 stars,In stock,B0BYDXVM5Q,"Take your tech around town in the one bag that holds it all. Whether you’re working from home or the office, in a café or meeting, here or anywhere—you’ll need a lightweight backpack with the pockets, protection, and comfort to keep you moving. Open the possibilities of productivity.Make room for making moves all around town and the world in one spacious yet sleek backpack. Put everything in its place with pockets big, small, secure, and easily accessible. Designed for packing light for fast moves, or expanding for your journeys.",Brand: HP
https://www.amazon.in/Safari-Overnighter-Resistant-Polyester-Travelling/dp/B097JK3X9D,"Safari Crew Overnighter Backpack, 40 Ltr Water Resistant Travel Laptop Bag, Black Polyester Backpack for Men and Women, Spacious Shoulder Bag for Travelling and Camping","₹1,799",225 ratings,4.3 out of 5 stars,In stock,B097JK3X9D,"Crew is yet another trendy offering from Safari's overnighter laptop backpack ranges. With a unique offering of luggage-like opening (or book opening), this bag is perfect to meet ALL your travel needs - Work or Adventure Leisure. Made out of water-resistant fabric & front panel design, it serves a highly elegant look. On the inside, cross packing straps are provided to help organise your packing. With a 17"" laptop compatibility compartment and an additional tablet section, Crew has a total capacity of 40 liters, provided with compression straps and breathable back mesh that prevents the back of the backpack from overheating. Go ahead and add one of Safari's exclusive Overnighter backpacks to your travel collection, whether it be for a short business trip or a weekend getaway!",Visit the Safari Store
https://www.amazon.in/Lavie-Womens-Ushawu-Satchel-Handbag/dp/B0B6RY5TX5,Lavie Women's Ushawu Satchel Bag | Ladies Purse Handbag,"₹1,249","6,822 ratings",4.1 out of 5 stars,In stock,B0B6RY5TX5,No Description,Visit the Lavie Store
https://www.amazon.in/Lenovo-GX40Q17226-15-6-Inch-Casual-Backpack/dp/B075Y7H8V6,"Lenovo 15.6"" Casual Backpack B210","₹1,034","4,099 ratings",4.3 out of 5 stars,In stock,B07JM9LQ6X,No Description,Brand: Lenovo
https://www.amazon.in/Bennett-15-6-inch-Repellent-Backpack-ben_cas_blue/dp/B09WZKB54G,"Bennett 15.6 inch Laptop Bag Men/Women, 25 L Water Resistant School/College Backpack with Padded Laptop Compartment for Dell/Lenovo/Asus/Hp/MacBook/Ultrabook/Thinkpad/IdeaPad (Blue)",₹512.00,168 ratings,3.7 out of 5 stars,In stock,B09WZKB54G,No Description,Visit the KBBRD Store
https://www.amazon.in/Stylish-Casual-Backpack-Laptop-College/dp/B07GXZPTRD,DZert Clasy Laptop Bag College Bag for Boys Girls 21 L Nevy Blue,₹339.00,"2,496 ratings",3.8 out of 5 stars,In stock,B07H1BPCGQ,No Description,Visit the DZert Store
https://www.amazon.in/FUR-JADEN-Weekender-Backpack-Organizer/dp/B0B34WVJ5X,"FUR JADEN 40L Weekender Travel Laptop Backpack with Anti Theft Pocket, Organizer, 15.6 Inch Padded Laptop Sleeve and Dual Handles","₹1,229",798 ratings,4.3 out of 5 stars,,B0B34WVJ5X,"Stay organized all day with a durable and lightweight backpack from Fur Jaden. This back pack is a stylish and functional accessory for men and women. It adds admiration to an appealing and daring personality with remarkable aesthetics and functionality. This backpack features an anti-theft pocket on the back. It comes with organizer pockets in the front compartment which helps keep your belongings organized. Fur Jaden functional back pack is apt to protect your gadgets and belongings from being stolen while you travel, thanks to its special anti-theft design. Now keep your belongings safe with style. The backpack features multiple compartments that you may use for your laptop and other essentials. Weighing about 600grams, this backpack is lightweight. The backpack is able to house a laptop of up to 15.6 inches and has several inner compartments to place your other essentials. Made from durable quality polymer this Fur Jaden back pack is sturdy and reliable. Flaunt this bag with style and low maintenance as this bag is washable. This backpack is also suitable for school or college. The straps are designed to distribute the weight equally on each shoulder preventing any sort of discomfort. Use this back pack for office, college/school or during travels.",Brand: FUR JADEN
https://www.amazon.in/Kore-K-REGULAR-GYM-BAG-Regular-Gym-Bag/dp/B09VLK27NF,Kore Regular Gym Bag,₹59.00,"1,932 ratings",2.6 out of 5 stars,In stock,B09VLK27NF,"This lightweight gym bag will stylishly carry your workout clothes and other essentials from your home to gym sport,This is the perfect value bag intended use for athletic, gym, travel, camping, hiking, weekend and carry on or overnight as it is spacious as well as functional,With a perfect combination of style and durability, you just can't go wrong with this bag.",Visit the Kore Store
https://www.amazon.in/EUME-Tourismo-Backpack-Resistance-15-6-inch/dp/B0B4JQSMD5,EUME Tourismo 36L Laptop Backpack Bag with 2 Large Compartment for Work Office & Business Travel for Men & Women | Water Resistance | Fit Up to 16 Inch Laptop,"₹2,499",7 ratings,4.4 out of 5 stars,In stock,B0BB2V2NFB,No Description,Visit the EUME Store
https://www.amazon.in/Elegant-Waterproof-Backpack-College-Business/dp/B0C6Y2Q5ZV,Elegant 16 inch 28 L Casual Waterproof Laptop Backpack/Office Bag/School Bag/College Bag/Business Bag/Unisex Travel Backpack,₹899,5 ratings,5.0 out of 5 stars,Only 4 left in stock,B0C6Y2Q5ZV,No Description,Brand: Elegant
https://www.amazon.in/Number-Backpack-Compartment-Charging-Organizer/dp/B09VTBYNHF,"FUR JADEN Anti Theft Number Lock Backpack Bag with 15.6 Inch Laptop Compartment, USB Charging Port & Organizer Pocket for Men Women Boys Girls",₹679,"4,921 ratings",4.0 out of 5 stars,,B09VTBYNHF,"Stay organized all day with a durable and lightweight backpack from Fur Jaden. This back pack is a stylish and functional accessory for men and women. Can add admiration to an appealing and daring personality with a remarkable aesthetics and functionality. This backpack features an anti-theft design. You can also charge your phone on the go and organize your stuff like pro. Fur Jaden functional back pack is apt to protect your gadgets and belongings from being stolen while you travel, thanks to its special anti-theft design. Now keep your belongings safe with style. The backpack features multiple compartments that you may use for your laptop and other essentials. A remarkable feature of this backpack allows you to charge your phone while you are on the move. With an attached charging dock in the back you may connect a portable power bank with ease. Weighing about 600grams, this backpack is lightweight. The backpack is able to house a laptop of up to 15.6 inches and has seven inner compartments to place your other essentials. Made from durable quality polymer this Fur Jaden back pack is sturdy and reliable. Flaunt this bag with style and low maintenance as this bag is washable. This backpack is also suitable for school or college. The straps are designed to distribute the weight equally on each shoulder preventing any sort of discomfort. Use this back pack for office, college/school or during travels.",Brand: FUR JADEN
https://www.amazon.in/Backpack-Business-Backpacks-Charging-Resistant/dp/B094DGSWH3,"FUR JADEN Travel Laptop Backpack, Business Backpacks with USB Charging Port, Water Resistant College School Computer Bag for Men & Women Fits Under 15.6 inch Laptop and Notebook",₹949,481 ratings,4.3 out of 5 stars,In stock,B094DGSWH3,No Description,Brand: FUR JADEN
https://www.amazon.in/Polyester-Crossbody-Messenger-Business-Spacious/dp/B0B564KY9P,CRALOFT Polyester 11.5 inch Side Bag For Men/Sling Bag/Crossbody Tablet Messenger Bag For Office Business Travel (Extra Spacious),₹529,452 ratings,4.3 out of 5 stars,In stock,B0B564KY9P,No Description,Visit the CRALOFT Store
https://www.amazon.in/POLICE-PT10414730_6-BRETHA-LAPTOP-BACKPACK/dp/B0BLCLXT65,POLICE BRETHA LAPTOP BACKPACK,₹999,2 ratings,3.0 out of 5 stars,In stock,B0BLCLXT65,"Pump up your style quotient a notch higher as you step out carrying casual backpack from the house of Police. It has a vibrant and stylish design, along with the added benefit of spacious interiors. Made from Nylon. The bag has padded adjustable back straps that provide carrying comfort. The back panel is also finely padded for ease when you are carrying the backpack.",Visit the POLICE Store
https://www.amazon.in/Safari-KANHA-Wheel-Trolley-Case/dp/B00LUMINPQ,"Genie Cleo Laptop Backpack for Women, 3 compartments, Stylish and Trendy College Bags for Girls, Water Resistant and Lightweight Bags for Office and Travelling Purpose. 36 litres (19 inch)",₹899,1 rating,1.0 out of 5 stars,In stock,B00LUMINPQ,"Genie Cleo Laptop Backpack for Women, 3 compartments, Stylish and Trendy College Bags for Girls, Water Resistant and Lightweight Bags for Office and Travelling Purpose.36 litres (19 inch) Black colour",Visit the Safari Store
https://www.amazon.in/Storite-Laptop-Shoulder-Messenger-Bag/dp/B08WZ9KP7Q,"Storite Multi-Pocket 15.6 Inch PU Leather Laptop Bag for Men, Shoulder Sling Business Messenger Office Bag Carrying Notebook, Tablet Handbags for Women","₹1,299.00",392 ratings,3.8 out of 5 stars,In stock,B08WZ9KP7Q,No Description,Brand: Storite
https://www.amazon.in/Trajectory-Messenger-Warranty-Compartment-Expandable/dp/B0B2PSMV6Y,Trajectory 15.6 Inch Vegan Leather Messenger Laptop bag for men in Office for all laptop like Apple MacBook with 2 Years Warranty and Spacious Multiple Compartment with Expandable Bottom Used as Shoulder and Handbag for Men,"₹1,399.00",476 ratings,4.1 out of 5 stars,In stock,B09RK6NCGC,No Description,Visit the Trajectory Store
https://www.amazon.in/Kenneth-Cole-Reaction-Polyester-Backpack/dp/B07GX3PWNK,"Kenneth Cole Reaction Women's Chevron Quilted Polyester Twill 15.6"" Laptop Backpack, Midnight Black, One Size","₹4,818","3,644 ratings",4.7 out of 5 stars,In stock,B07GX3PWNK,No Description,Brand: Kenneth Cole
https://www.amazon.in/ADISA-Backpack-Office-College-Travel/dp/B09Y8FMDVB,ADISA Backpack Office Bag College Travel Back Pack 32 Ltrs (Navy Blue),₹499.00,202 ratings,4.0 out of 5 stars,In stock,B09Y8FMDVB,No Description,Visit the ADISA Store
https://www.amazon.in/Flamingo-Cosmetic-Sichumaria-Water-Resistant-Organizer/dp/B0B9BVZQNJ,Sichumaria Flamingo Cosmetic Bag Portable Travel Makeup Bag for Women Large Travel Water-Resistant Zipper Makeup Organizer for Girls Make Up Bag Brush Bags (Pink),₹238.00,72 ratings,3.9 out of 5 stars,In stock,B0B1HNQHXD,No Description,Brand: Sichumaria
https://www.amazon.in/Safari-Laptop-Backpack-Resistant-Fabric/dp/B09B28TKLG,Safari Quill Large Laptop Backpack 26 Ltrs Water Resistant Fabric - Blue,₹899,712 ratings,4.0 out of 5 stars,In stock,B09B28TKLG,"Safari Quill is a 26 Litres, 2 compartment laptop backpack perfect for daily usage. It has a dedicated tech safe laptop sleeve that can hold upto 17 inch laptop or any smaller ones easily. The laptop sleeve is also fully padded from the bottom protecting your device from any shock or damage. This backpack is especially designed for todays fast paced world, where everything should be compact and lightweight. This backpack is perfect for everyday usage such as college, school, tuitions, or short holiday trips. The front pocket is designed to keep your essentials organized and side mesh pockets are perfect for storing your water bottle and umberella. Made of high grade water resistant polyester fabric, this backpack will last you several trips.",Visit the Safari Store
https://www.amazon.in/EUME-Tourismo-Backpack-Resistance-15-6-inch/dp/B0B4JQSMD5,EUME Tourismo 36L Laptop Backpack Bag with 2 Large Compartment for Work Office & Business Travel for Men & Women | Water Resistance | Fit Up to 16 Inch Laptop,"₹2,499",7 ratings,4.4 out of 5 stars,In stock,B0BB2V2NFB,No Description,Visit the EUME Store
https://www.amazon.in/Waterproof-Backpack-Students-adjustable-Compartment/dp/B09RJ2MCJY,CAPRIFF 32 L Casual Waterproof Laptop Bag/Backpack for Men Boys & Girls For Office School College Teens & Students with Rain Cover With adjustable Strap With 2 Compartment,₹539,"3,102 ratings",3.8 out of 5 stars,In stock,B09RJ2MCJY,"Teal in color so that it does not catch dust easily || A SECRET POCKET at bottom || Designed For Comfort- back padded and padded strap for more comfort || made from heavy quality nylon and polyester || best quality zip and chain used || It is fully waterproof to protect your books laptop from rain || best quality material used to design its inside structure || a fully paddded laptop sleeve that fit to all sizes and companies of laptop like HP , Dell , Asus , Lenovo , mi etc",Visit the CAPRIFF Store
https://www.amazon.in/Wildcraft-Shutter-Bug-Camera-Backpack/dp/B07GVJ5LZB,Wildcraft Shutter Bug Camera Backpack - Black,"₹3,495.00",855 ratings,4.5 out of 5 stars,In stock,B07GVJ5LZB,Wildcraft Shutter Bug Camera Backpack - Black,Brand: Wildcraft
https://www.amazon.in/Tommy-Hilfiger-Jorden-Polyester-Closure/dp/B0BXFFPBQK,Tommy Hilfiger Polyester 44 cms Red + White + Navy Gym Shoulder Bag (TH/JORDEN041508),"₹1,539.00",32 ratings,4.2 out of 5 stars,Only 1 left in stock,B082PG1X96,Tommy Hilfiger goods are manufactured with detail to perfection & high quality materials are used.,Visit the Tommy Hilfiger Store
https://www.amazon.in/Martucci-Waterproof-Backpack-College-Business/dp/B0BSCFJZB7,Martucci Jersey 45L Casual Waterproof Laptop Backpack/Office Bag/School Bag/College Bag/Business Bag/Unisex Travel Backpack,₹809,156 ratings,3.6 out of 5 stars,Only 3 left in stock,B0BSCFJZB7,No Description,Visit the Martucci Store
https://www.amazon.in/PUMA-Limoges-Laptop-Backpack-7548709/dp/B07D5QZ76G,"Puma Laptop Backpack (7548709, Limoges, 22 Ltrs)",₹999.00,788 ratings,4.3 out of 5 stars,In stock,B07D5QZ76G,Product Description,Brand: Puma
https://www.amazon.in/CLOWNFISH-Critters-Polyester-Backpack-Staionery/dp/B0BW95XNTK,THE CLOWNFISH Cosmic Critters Series Printed Polyester 15 Litres Kids Backpack Unisex School Bag with Free Pencil Staionery Pouch Daypack Casual Backpack Picnic Bag for tiny tots boys & girls,₹799,192 ratings,4.4 out of 5 stars,In stock,B0BW95XNTK,No Description,Visit the The Clownfish Store
https://www.amazon.in/Puma-unisex-adult-Laptop-Backpack-Red-Peacoat/dp/B0B4SD1LSM,Puma unisex-adult PUMA Laptop Backpack IND III Puma Red-Peacoat Laptop,"₹1,125",29 ratings,2.8 out of 5 stars,In stock,B0B4SD1LSM,No Description,Brand: Puma
https://www.amazon.in/American-Tourister-40X-09-009/dp/B00FRCNTUO,American Tourister X-Bag Nylon 65 Cms Travel Duffle Bag (Black),"₹2,099",394 ratings,4.3 out of 5 stars,In stock,B00FRCNTUO,"Made from tough and durable, yet lightweight, Cuzy nylon material, the entire range of duffel bags is available to buy online. With a spacious main section and complementary side and front pockets, the duffel bags are designed to pack in all your necessary travel gear. Designed for unisex use. Given the range of our consumer’s unique needs, some of our designs also come equipped with adjustable straps to sling the duffel bag across the shoulders, as an added advantage to the adventurous consumer who may take the bag on a trek or road-trip. Available in varying sizes when you shop online, our duffel bags will be the perfect travel companion no matter where you go. Irrespective of your needs, you will find your perfect solution when you shop online from our duffel bag collection.",Brand: American Tourister
https://www.amazon.in/Safari-Laptop-Backpack-Resistant-Fabric/dp/B09B25Z8M2,Safari Quill Large Laptop Backpack 26 Ltrs Water Resistant Fabric - Black,₹899,971 ratings,3.9 out of 5 stars,In stock,B09B25Z8M2,"Safari Quill is a 26 Litres, 2 compartment laptop backpack perfect for daily usage. It has a dedicated tech safe laptop sleeve that can hold upto 17 inch laptop or any smaller ones easily. The laptop sleeve is also fully padded from the bottom protecting your device from any shock or damage. This backpack is especially designed for todays fast paced world, where everything should be compact and lightweight. This backpack is perfect for everyday usage such as college, school, tuitions, or short holiday trips. The front pocket is designed to keep your essentials organized and side mesh pockets are perfect for storing your water bottle and umberella. Made of high grade water resistant polyester fabric, this backpack will last you several trips.",Visit the Safari Store
https://www.amazon.in/Elegant-Waterproof-Backpack-College-Business/dp/B0C6Y2Q5ZV,Elegant 16 inch 28 L Casual Waterproof Laptop Backpack/Office Bag/School Bag/College Bag/Business Bag/Unisex Travel Backpack,₹899,5 ratings,5.0 out of 5 stars,Only 4 left in stock,B0C6Y2Q5ZV,No Description,Brand: Elegant
https://www.amazon.in/uppercase-Professional-resistant-sustainable-Anti-theft/dp/B0BR5NDW4N,"uppercase SealPro Professional Laptop Backpack (15.6 Inch) 3x more water resistant sustainable bags with rain proof zippers & Anti-theft for Men, Women, Boys and Girls, 750 Days warranty","₹1,900",69 ratings,4.6 out of 5 stars,In stock,B0BR5NDW4N,No Description,Visit the uppercase Store
https://www.amazon.in/POLICE-Backpack-Casual-College-Polyester/dp/B0BHNJK832,POLICE Backpack for Men Casual Laptop Bag Office/Travel/College 30 Ltr Hedge Polyester - Black,"₹1,399","5,735 ratings",4.1 out of 5 stars,In stock,B0BHNJK832,Backpack,Visit the POLICE Store
https://www.amazon.in/Number-Backpack-Compartment-Charging-Organizer/dp/B09VTBYNHF,"FUR JADEN Anti Theft Number Lock Backpack Bag with 15.6 Inch Laptop Compartment, USB Charging Port & Organizer Pocket for Men Women Boys Girls",₹679,"4,921 ratings",4.0 out of 5 stars,,B09VTBYNHF,"Stay organized all day with a durable and lightweight backpack from Fur Jaden. This back pack is a stylish and functional accessory for men and women. Can add admiration to an appealing and daring personality with a remarkable aesthetics and functionality. This backpack features an anti-theft design. You can also charge your phone on the go and organize your stuff like pro. Fur Jaden functional back pack is apt to protect your gadgets and belongings from being stolen while you travel, thanks to its special anti-theft design. Now keep your belongings safe with style. The backpack features multiple compartments that you may use for your laptop and other essentials. A remarkable feature of this backpack allows you to charge your phone while you are on the move. With an attached charging dock in the back you may connect a portable power bank with ease. Weighing about 600grams, this backpack is lightweight. The backpack is able to house a laptop of up to 15.6 inches and has seven inner compartments to place your other essentials. Made from durable quality polymer this Fur Jaden back pack is sturdy and reliable. Flaunt this bag with style and low maintenance as this bag is washable. This backpack is also suitable for school or college. The straps are designed to distribute the weight equally on each shoulder preventing any sort of discomfort. Use this back pack for office, college/school or during travels.",Brand: FUR JADEN
https://www.amazon.in/Waterproof-Laptop-College-Backpack-Navy_Blue/dp/B0BW9BJVS5,30 L Waterproof Laptop/College/School/Office Bag Backpack for Men Women Boys Girls with Rain Cover (Navy_Blue),₹486,6 ratings,4.6 out of 5 stars,In stock,B0BW9BJVS5,"A sporty versatile Backpack from Northzone. It has a top opening compartment for quick & easy access to essentials while the mesh padding on the back panel will feel comfortable, even on a hot day. This backpack can be carried in 2 ways as it has an additional front handle to hold it in case you’re unable to carry it on your back.",Brand: NORTH ZONE
https://www.amazon.in/Skybags-Ltrs-Casual-Backpack-BPNNE18HBLU/dp/B08QGPK772,Skybags 32 Ltrs Blue Casual Backpack (BPNNE18HBLU),"₹1,399",524 ratings,4.1 out of 5 stars,In stock,B08QGPK772,"Skybags is a fun and cool brand for today's youth. We believe in adding colour to your life by offering stylish, colourful and premium products. Our new neon backpack is perfect for all your school requirements as it is spacious enough to fit in all your Books and stationery.",Visit the Skybags Store
https://www.amazon.in/ADISA-Laptop-Backpack-Office-College/dp/B0BPVCBFM7,ADISA 32L Large Laptop Backpack Office Bag College Travel Back Pack with rain Cover (Green),₹646.00,261 ratings,3.8 out of 5 stars,In stock,B0BPVCBFM7,No Description,Visit the ADISA Store
https://www.amazon.in/American-Tourister-BOUNCE-BACKPACK-POLYESTER/dp/B0C49DQ7GG,American Tourister BOUNCE CASUAL BACKPACK 28L POLYESTER RED,"₹1,199",38 ratings,4.0 out of 5 stars,In stock,B0C49DQ7GG,No Description,Brand: American Tourister
https://www.amazon.in/Lavie-Womens-Ladies-Purse-Handbag/dp/B0CBC9BR3S,Lavie Women's Pavo Tote Bag | Ladies Purse Handbag,₹902,"4,894 ratings",4.1 out of 5 stars,In stock,B0CBC9BR3S,Master the language of true fashion with Lavie voguish P Blue tote and reflect style in your looks during social events and casual parties with your friends.Grasp the genuine experience of a ladylike look by Coupling it with exceptional flared dress and trendy siphons. Spruce up the look with a sparkling shades.,Visit the Lavie Store
https://www.amazon.in/Safari-Formal-Backpack-Anti-Theft-VAULT19CBBLK/dp/B07XSTR69N,"Safari 48 Cms Black Formal/Office/Laptop Backpack With Anti-Theft, Lock, Usb And Rfid (Vault19Cbblk)","₹1,197",877 ratings,4.0 out of 5 stars,In stock,B07XSTR69N,"Vault backpack is the only true ant theft backpack in the market. With an anti theft construction which keeps your laptop close to you, It also has an actual fixed lock so your belongings are always Completely secure. To protect your credit and debit cards, there is a dedicated rid pocket for your wallet. It also comes with a USB port to charge your devices on the go. The main compartment has been thoughtfully designed with tiny pockets so you can keep all your stuff organized.",Visit the Safari Store
https://www.amazon.in/Storite-Leather-Laptop-Bag-inch/dp/B081GQL8VF,"Storite PU Leather 14 inch Laptop Messenger Organizer Bag/Shoulder Sling Office Bag for Men & Women – (37x 27x7 cm, DarkBrown)",₹899.00,9 ratings,4.3 out of 5 stars,In stock,B081GQL8VF,No Description,Brand: Storite
https://www.amazon.in/Right-Choice-Stylish-College-Backpack/dp/B07ZVXL8RH,RIGHTCHOICE Quality Stylish Casual Backpack Daily use Unisex Typography College Bags (Boys and Girls),₹259,975 ratings,3.5 out of 5 stars,In stock,B07ZVXL8RH,"A stylish bag that always looks as good as you do. Comfortable to carry without compromising on style/fashion. It is designed to be convenient, and has safe storage. Makes a standout addition to your collection",Brand: RIGHT CHOICE
https://www.amazon.in/BetterShine-Printed-Capacity-Waterproof-Compartment/dp/B0CC2X1ZJR,BetterShine Floral Printed Stylish Bag With 25 Litre Capacity Waterproof With Laptop Compartment,₹699,,Previous page,In stock,B0CC2X1ZJR,"We Presents Printed Stylish Backpack for Boys And Girls with Standard Size and Suitable in All Places and Made by Strenthen Material Polyster Waterproof . And Useful For College ,School , Kids , Coaching Purpose Etc. Best Comfortable For in All Condition.Pen Pocket and Card Pocket Available. Laptop Compartment Also Available.",Brand: BetterShine
https://www.amazon.in/WALKENT-Waterproof-Laptop-Pockets-Cushioned/dp/B0CC5SRCP8,"WALKENT Waterproof Laptop Bag for Men with Side Bottle Pockets, Cushioned Straps & More P3","₹4,990",,Previous page,Only 4 left in stock,B0CC5SRCP8,"WALKENT Waterproof Laptop Bag for Men with Side Bottle Pockets, Cushioned Straps & More P3",Visit the WALKENT Store
https://www.amazon.in/Gear-Samurai-Black-Casual-Backpack/dp/B0B4SBWW8H,F Gear Samurai 29 Ltrs Black Casual Backpack,"₹1,249",90 ratings,4.1 out of 5 stars,In stock,B0B4SBWW8H,No Description,Brand: F Gear
https://www.amazon.in/Sprqcart-Travel-Shoulder-Weekender-Overnight/dp/B0C3RCBJR1,"Sprqcart Travel Duffel Bag, Sports Tote Gym Bag, Shoulder Weekender Overnight Bag for Women (Green)",₹474.05,22 ratings,4.5 out of 5 stars,In stock,B0C3RBGHCN,No Description,Brand: Sprqcart
