Product URL,Product Name,Product Price,Rating,Number of Reviews,availability,ASIN,Product Description,Manufacturer
https://www.amazon.in/Number-Backpack-Compartment-Charging-Organizer/dp/B09VTBYNHF,"FUR JADEN Anti Theft Number Lock Backpack Bag with 15.6 Inch Laptop Compartment, USB Charging Port & Organizer Pocket for Men Women Boys Girls",₹679,"4,921 ratings",4.0 out of 5 stars,,B09VTBYNHF,"Stay organized all day with a durable and lightweight backpack from Fur Jaden. This back pack is a stylish and functional accessory for men and women. Can add admiration to an appealing and daring personality with a remarkable aesthetics and functionality. This backpack features an anti-theft design. You can also charge your phone on the go and organize your stuff like pro. Fur Jaden functional back pack is apt to protect your gadgets and belongings from being stolen while you travel, thanks to its special anti-theft design. Now keep your belongings safe with style. The backpack features multiple compartments that you may use for your laptop and other essentials. A remarkable feature of this backpack allows you to charge your phone while you are on the move. With an attached charging dock in the back you may connect a portable power bank with ease. Weighing about 600grams, this backpack is lightweight. The backpack is able to house a laptop of up to 15.6 inches and has seven inner compartments to place your other essentials. Made from durable quality polymer this Fur Jaden back pack is sturdy and reliable. Flaunt this bag with style and low maintenance as this bag is washable. This backpack is also suitable for school or college. The straps are designed to distribute the weight equally on each shoulder preventing any sort of discomfort. Use this back pack for office, college/school or during travels.",Brand: FUR JADEN
https://www.amazon.in/Victorinox-Victoria-Signature-Backpack-612201/dp/B0936J74KR,"Victorinox Victoria Signature Women Deluxe Backpack, 15'' Laptop & 10'' Tablet Pocket, Black, Swiss designed (612201)","₹25,860",1 rating,5.0 out of 5 stars,Only 1 left in stock,B0936J74KR,"PREMIUM. PROFESSIONAL. PRACTICAL. Victorinox presents the Victoria Signature collection that elevates our Victoria 2.0 styles while also giving a nod to the Swiss heritage. Each piece features the actual signature of the founder's mother, Victoria Elsener, engraved on a leather patch. With the discrete V motif, dedicated organization, sleek construction and removable pouch, these bags take versatile business functionality to sensational new heights. Each piece takes you effortlessly from work to play. And beyond.",Visit the Victorinox Store
https://www.amazon.in/American-Tourister-AMT-SCH-02/dp/B07CJCGM1M,American Tourister Fizz Large Size 32 Ltrs Casual Backpack (BLACK),"₹1,199.00","55,005 ratings",4.0 out of 5 stars,In stock,B07CJCGM1M,No Description,Brand: American Tourister
https://www.amazon.in/Wesley-Milestone-Waterproof-Backpack-Business/dp/B084JGJ8PF,Wesley Milestone 2.0 Casual Waterproof Laptop Backpack/Office Bag/School Bag/College Bag/Business Bag/Travel Backpack (Dimensions:13x18 inches) (Compatible with 39.62cm(15.6inch laptop) 30 L (Blue & black),₹550.00,"11,841 ratings",4.3 out of 5 stars,Available to ship in 1-2 days,B084JGJ8PF,No Description,Brand: Wesley
https://www.amazon.in/Skybags-Brat-Black-Casual-Backpack/dp/B08Z1HHHTD,Skybags Brat Black 46 Cms Casual Backpack,₹669,"5,188 ratings",4.1 out of 5 stars,In stock,B08Z1HHHTD,"Ideal for a college student who does not carry a lot of books or laptop to college. Very stylish, slim and feature loaded Backpack",Visit the Skybags Store
https://www.amazon.in/Sirona-Sanitary-Napkin-Diapers-Disposal/dp/B01NAZVN8M,"Sirona Sanitary Disposal Bags | 75 Bags | Pad Disposable Bags for Discreet Disposal of Tampons, Condoms, Diaper, Sanitary Pads, Panty Liner & Personal Hygiene Waste (Green)",₹211.00,"2,922 ratings",4.5 out of 5 stars,In stock,B01NAZVN8M,"Now Bigger & Better! Worried about disposing your Sanitary & Intimate Products? Made in India, 'I Love Clean' by SIRONA are Cute Oxo BioDegradable Disposable Sanitary Bags & are best for Hygienic Disposal of Intimate Care Products (Sanitary Pads, Tampons, Panty Liners, Baby Diapers, Condoms, PeeBuddy) or General products (which need discreet disposal). No More Black Plastic Bags, No More Newspaper. Now use I LOVE CLEAN. The bags are tear resistant and seal perfectly to ensure zero bad odour or leakage.",Visit the Sirona Store
https://www.amazon.in/Half-Moon-Waterproof-Backpack-Students/dp/B085MHDJ93,"Half Moon 35 Ltrs Water Resistant 15.6 inch Laptop Bag for Men/Backpack for Men, Navy Blue | Office Bag for Men/Office Bag for Women with Padded Laptop Compartment | Rain Cover & Reflective Strips",₹649,"16,585 ratings",3.9 out of 5 stars,In stock,B085MHDJ93,No Description,Visit the Half Moon Store
https://www.amazon.in/Gear-Classic-Leather-Backpack-LBPCLSLTH0201/dp/B07G4F6XFH,Gear Classic 20L Faux Leather Water Resistant Anti Theft Laptop Bag/Backpack for Men/Women (Brown),₹987,"5,919 ratings",4.4 out of 5 stars,In stock,B07G4F6XFH,"Gear bags are designed for the quick commute as well for the long journey. these backpacks can be used as laptop bags,adventure bags and so on. Your favorite travel companion, The backpacks come with enough storage space to carry all your requirements.",Visit the Gear Store
https://www.amazon.in/Hammonds-Flycatcher-Genuine-Leather-Messenger/dp/B093KHDT8X,HAMMONDS FLYCATCHER Laptop Bag for Men - Genuine Leather Messenger Shoulder Bag - Fits 14/15.6/16 Inch Laptops - Brown Office Bag - Multiple Pockets -Water Resistant -Executive Bag for Work and Travel,"₹5,255.00",571 ratings,4.4 out of 5 stars,In stock,B083M1QK32,No Description,Visit the HAMMONDS FLYCATCHER Store
https://www.amazon.in/Half-Moon-Backpack-Luggage-Compartment/dp/B09VCL8D6S,Half Moon Large 37L Laptop Bag Backpack for menं Women Boys and Girls Luggage Travel Bags with 17.3 inches Laptop Compartment & Rain Cover,₹849,"3,224 ratings",3.9 out of 5 stars,In stock,B09VCL8D6S,"This backpack is lightweight water-resistant, capacity of approx 37 Ltr, has a soft and ventilated back panel, and is perfect for carrying all your necessities. Adjustable and breathable padded shoulder strap to meet different requirements for both men and women; made from highly rip and water-resistant polyester fabric, provide strengthen and long-lasting performance; roomy enough for your traveling requirements also having a Rain cover.",Visit the Half Moon Store
https://www.amazon.in/American-Tourister-BACKPACK-COMPARTMENT-ORGANIZER/dp/B0BTD4S4XF,"American Tourister VALEX BLACK LAPTOP BACKPACK 28 Ltrs,Volume, LAPTOP COMPARTMENT, BOTTLE POCKET, FRONT ORGANIZER","₹1,199",560 ratings,4.3 out of 5 stars,In stock,B0BTD4S4XF,"A backpack isn’t just a bag. It’s a cache, a case, a mobile base of sorts. And it is a reflection of the care you’ve put into selecting the ideal loadout of items to keep on you. Introducing Valex, a modern everyday backpacks collections are available in a variety of nice looking colours to express your true self",Brand: American Tourister
https://www.amazon.in/POLICE-Backpack-Casual-College-Polyester/dp/B0BHNJK832,POLICE Backpack for Men Casual Laptop Bag Office/Travel/College 30 Ltr Hedge Polyester - Black,"₹1,399","5,735 ratings",4.1 out of 5 stars,In stock,B0BHNJK832,Backpack,Visit the POLICE Store
https://www.amazon.in/Backpack-Business-Backpacks-Charging-Resistant/dp/B094DGSWH3,"FUR JADEN Travel Laptop Backpack, Business Backpacks with USB Charging Port, Water Resistant College School Computer Bag for Men & Women Fits Under 15.6 inch Laptop and Notebook",₹949,481 ratings,4.3 out of 5 stars,In stock,B094DGSWH3,No Description,Brand: FUR JADEN
https://www.amazon.in/MosQuick%C2%AE-Drawstring-Organizing-Stationery-multipurpose/dp/B09TTJSPDP,"MosQuick® Clear large Drawstring Bags Clear Plastic Travel Bags, Travel Garments Organizing Storage Plastic Bags ,Shoe bags , Stationery Bag,multipurpose bag - Translucent",₹420,69 ratings,4.0 out of 5 stars,In stock,B09TTJSPDP,No Description,
https://www.amazon.in/Amazon-Brand-Presto-Oxo-Biodegradable-Garbage/dp/B0821PYKVK,"Presto! Oxo-Biodegradable Garbage Bags, Large (24 x 32 inches) - 15 bags/roll (Pack of 6, Black, plastic)",₹329.00,"29,874 ratings",4.3 out of 5 stars,In stock,B0821PYKVK,"Presto! offers Oxo-Biodegradable Garbage Bags to help you maintain cleanliness and hygiene in your house, office and surroundings. These garbage bags make clean-up and garbage disposal a hassle-free task while being easy on the environment! Large in size, they easily fit any large dustbins, allowing you to clean out overflowing trash. Or store away old clothes for donation or clear out your yard, garden or basement. Handy at offices or hotels, they’re useful for getting rid of leftover party plates and garbage as well. They come with a detachable tie-tape which lets you neatly tie up the bag, making it easier to carry out after use. They are available in black colour in a pack of 6 rolls, and each roll contains 15 bags for your convenience.",Brand: Presto!
https://www.amazon.in/Amazon-Brand-Presto-Oxo-Biodegradable-Garbage/dp/B0821PN8L4,"Amazon Brand - Presto! Oxo-Biodegradable Garbage Bags, Medium -(19 x 21 inches) - 30 bags/roll (Pack of 6, Black)",₹319.00,"33,504 ratings",4.4 out of 5 stars,In stock,B0821PN8L4,"Amazon Brand - Presto! Oxo-Biodegradable Garbage Bags, Medium - 30 bags/roll (Pack of 6)",Brand: Presto!
https://www.amazon.in/Amazon-Basics-Laptop-Backpack-Repellent/dp/B09W3XLDM2,AmazonBasics Laptop Backpack,₹839.00,648 ratings,4.2 out of 5 stars,In stock,B09W3XLDM2,No Description,Brand: amazon basics
https://www.amazon.in/AmazonBasics-Zippered-Storage-Bags-Window/dp/B07JJCJG5W,"AmazonBasics Zippered Storage Bag with Window, Rectangular",₹659.00,"1,717 ratings",4.3 out of 5 stars,In stock,B07JJCJG5W,No Description,Brand: Amazon Basics
https://www.amazon.in/AmazonBasics-Vacuum-Compression-Storage-Bags/dp/B07RSCPH4N,"AmazonBasics Vacuum Compression Storage Bags with Hand Pump - Large, 5-Pack",₹799.00,"10,390 ratings",4.5 out of 5 stars,In stock,B07RSCPH4N,No Description,Brand: Amazon Basics
https://www.amazon.in/AmazonBasics-Ltrs-Large-Duffel-Bag/dp/B09MJ96GNY,AmazonBasics Nylon 43 Cms Travel Duffle Bag (Red),"₹1,727.00","6,828 ratings",4.3 out of 5 stars,In stock,B01GGNW5AM,"AmazonBasics 98 Ltrs Large Duffel Bag, Red",Brand: amazon basics
https://www.amazon.in/Gear-Black-Laptop-Backpack-LBPASPIRE0104/dp/B09ZLDHP3L,Gear Cello 30 Ltrs Black Laptop Backpack (LBPASPIRE0104),"₹1,125","5,912 ratings",4.4 out of 5 stars,In stock,B09ZLDHP3L,No Description,Brand: Gear
https://www.amazon.in/NORTH-ZONE-Waterproof-Backpack-Dimensions/dp/B0BS6NW684,NORTH ZONE Casual Waterproof Laptop Backpack/Office Bag/School Bag/College Bag/Business Bag/Travel Backpack (Dimensions:13x18 inches) (Compatible with 39.62cm(15.6inch laptop) 30 L,₹630,476 ratings,4.0 out of 5 stars,In stock,B0BS6NW684,"Care Instructions: Do not expose to extreme heat The Hype 1 Casual Backpack from Northzone Sport features an elegant look and feel. It is a perfect every day carry for speedy city commutes, college or school. Keeping it unique and stylish, this Northzone backpack features a versatile shaded design with the Northzone logo print on the face of the bag. Sturdy, spacious and elegant are the spirit of this backpack. Plenty of Space & Pockets: This college bags for girls and boys features two spacious compartments that can each fit book, iPad, A4 size files, lunch box, light clothes, school supplies & accessories. It also features a zip compartment with multiple organizer pockets for keys, pens, pencils, cell phone, power bank, etc. The twin mesh pockets on each side helps pack in a water bottle and a compact umbrella. Lightweight & Sturdy: This school bags for girls and boys features a multi ventilated 10mm robust mesh padding that provides maximum back support. The straps are breathable, padded and adjustable that helps to relieve the stress on your shoulder. The top of the backpack features a webbing loop top handle that helps in carrying the backpack with ease. External Dimension: Length – 33cm, Width – 21cm, Height – 49cm, Weight – 1,000 grams. Capacity – 34 litres. Laptop Compatibility – yes",Brand: NORTH ZONE
https://www.amazon.in/TRUE-HUMAN-Anti-Theft-backpack-charging/dp/B09QJ7ZF2Y,"TRUE HUMAN Emperor Anti-Theft backpack With USB charging Port Laptop Bag, Office bag, college bag and anti -theft back pocket (Black)",₹689,"2,313 ratings",3.8 out of 5 stars,In stock,B09QJ7ZF2Y,No Description,Visit the TRUE HUMAN Store
https://www.amazon.in/Lenovo-15-6-Inches-Everyday-Backpack/dp/B08R7RPVJF,"Lenovo 15.6"" (39.62cm) Slim Everyday Backpack, Made in India, Compact, Water-resistant, Organized storage:Laptop sleeve,tablet pocket,front workstation,2-side pockets,Padded adjustable shoulder straps",₹839.00,"3,713 ratings",4.3 out of 5 stars,In stock,B08R7RPVJF,No Description,Brand: Lenovo
https://www.amazon.in/ADISA-Laptop-Backpack-Office-College/dp/B09TPX22NF,ADISA 15.6 inch Laptop Backpack Office Bag College Travel Back Pack 32 Ltrs (z-Navy Blue),₹549.00,"1,017 ratings",3.9 out of 5 stars,In stock,B09TPX22NF,No Description,Visit the ADISA Store
https://www.amazon.in/Gear-CarryOn-Foldable-Resistant-Backpack/dp/B0BZVRTXCR,Gear CarryOn 16L Foldable Water Resistant School Bag//Backpack/College Bag for Men/Women - Blue Black,₹224,"6,833 ratings",3.7 out of 5 stars,In stock,B0BZVRTXCR,No Description,Brand: Gear
https://www.amazon.in/American-Tourister-BACKPACK-COMPARTMENT-ORGANIZER/dp/B0BTD4FK9G,"American Tourister VALEX BLUE LAPTOP BACKPACK 28 Ltrs,Volume, LAPTOP COMPARTMENT, BOTTLE POCKET, FRONT ORGANIZER","₹1,399",517 ratings,4.2 out of 5 stars,In stock,B0BTD4FK9G,"A backpack isn’t just a bag. It’s a cache, a case, a mobile base of sorts. And it is a reflection of the care you’ve put into selecting the ideal loadout of items to keep on you. Introducing Valex, a modern everyday backpacks collections are available in a variety of nice looking colours to express your true self",Brand: American Tourister
https://www.amazon.in/Half-Moon-Spacious-Backpack-Compartment/dp/B0BLVQG973,Half Moon Strike 35L Unisex Spacious School/Laptop/College/Office Travel Backpack Bag for Men Women Boys & Girls with 15.6 inch Padded Laptop Compartment & Multiple Pockets,₹699,575 ratings,3.8 out of 5 stars,In stock,B0BLVQG973,"A super-slim design, trendy looks and durable construction - this stylish 35 L backpack from Half Moon has got everything that will complement your youthful personality. With its spacious interiors, this unisex backpack is a great option for short road trips, college and work. Ergonomic design Crafted from polyester, this medium backpack is sturdy enough to withstand regular wear and tear gracefully. It features a cushioned base and internal back padding to offer you extra comfort. The padded shoulder straps of this bag can be easily adjusted according to your liking. Spacious Featuring one front pocket and three main compartments, all with speciality zippers, this bag offers you enough space to carry your books, files, coins, travel accessories, stationery, keys and mobile accessories. It comes with the Half Moon promise of quality.",Visit the Half Moon Store
https://www.amazon.in/Laptop-Backpack-School-College-Charging/dp/B09WCHGK86,"Fur Jaden 15.6 Inch Laptop Backpack 25 LTR Bag for School, College and Office with USB Charging Port",₹479.00,"10,300 ratings",3.9 out of 5 stars,In stock,B07J46KLFP,No Description,Brand: FUR JADEN
https://www.amazon.in/EUME-Tourismo-Backpack-Resistance-15-6-inch/dp/B0B4JQSMD5,EUME Tourismo 36L Laptop Backpack Bag with 2 Large Compartment for Work Office & Business Travel for Men & Women | Water Resistance | Fit Up to 16 Inch Laptop,"₹2,499",7 ratings,4.4 out of 5 stars,In stock,B0BB2V2NFB,No Description,Visit the EUME Store
https://www.amazon.in/Sirona-Sanitary-Napkin-Diapers-Disposal/dp/B01NAZVN8M,"Sirona Sanitary Disposal Bags | 75 Bags | Pad Disposable Bags for Discreet Disposal of Tampons, Condoms, Diaper, Sanitary Pads, Panty Liner & Personal Hygiene Waste (Green)",₹211.00,"2,922 ratings",4.5 out of 5 stars,In stock,B01NAZVN8M,"Now Bigger & Better! Worried about disposing your Sanitary & Intimate Products? Made in India, 'I Love Clean' by SIRONA are Cute Oxo BioDegradable Disposable Sanitary Bags & are best for Hygienic Disposal of Intimate Care Products (Sanitary Pads, Tampons, Panty Liners, Baby Diapers, Condoms, PeeBuddy) or General products (which need discreet disposal). No More Black Plastic Bags, No More Newspaper. Now use I LOVE CLEAN. The bags are tear resistant and seal perfectly to ensure zero bad odour or leakage.",Visit the Sirona Store
https://www.amazon.in/ZEBRONICS-Compartment-Backpacks-15-6-inch-Polyester/dp/B0C6QNNPMM,"ZEBRONICS Camp1, 14 Liters, 1 Compartment Laptop Backpacks Fit Up to 15.6-inch Laptop, Polyester Fabric, Office Use and Mini Business Travel Bags (Grey)",₹499.00,,Previous page,In stock,B0C6QNNPMM,"ZEBRONICS Camp1, 14 Liters, 1 Compartment Laptop Backpacks Fit Up to 15.6-inch Laptop, Polyester Fabric, Office Use and Mini Business Travel Bags (Grey)",Visit the ZEBRONICS Store
https://www.amazon.in/POLICE-Backpack-Casual-College-Polyester/dp/B0BHNJK832,POLICE Backpack for Men Casual Laptop Bag Office/Travel/College 30 Ltr Hedge Polyester - Black,"₹1,399","5,735 ratings",4.1 out of 5 stars,In stock,B0BHNJK832,Backpack,Visit the POLICE Store
https://www.amazon.in/Wesley-Spartan-Hiking-Raincover-Organiser/dp/B098QFF5TJ,Wesley Spartan Unisex Travel Hiking Laptop Bag fits Upto 17.3 inch with Raincover and Internal Organiser Backpack Rucksack College Bag,₹749,"1,556 ratings",4.1 out of 5 stars,In stock,B09NM65GXJ,Wesley Spartan Unisex Travel Hiking Laptop Bag fits Upto 17.3 inch with Raincover and Internal Organiser Backpack Rucksack College Bag,Brand: Wesley
https://www.amazon.in/SAFARI-Ltrs-Casual-Backpack-DAYPACKNEO15CBSEB/dp/B07Q7CNPMV,Safari Compact Size 15 Ltrs Casual Backpack For Unisex Adult - Sea Blue,₹248,"20,014 ratings",4.0 out of 5 stars,In stock,B07Q7CNPMV,"Be it your short trips or your daily travel across the city, daypack has got you covered. With a 15 litre capacity daypack lets you carry your wallet, umbrella, kerchief, keys, earphones, Notepad, pens and other Essentials. The drawstring compartment lets you dump things that you pick up on your way. Compact Size and 2 Compartment.",Visit the Safari Store
https://www.amazon.in/ADISA-Laptop-Backpack-Office-College/dp/B0BPVLXD53,ADISA 32L Large Laptop Backpack Office Bag College Travel Back Pack with rain Cover (Grey),₹699.00,261 ratings,3.8 out of 5 stars,In stock,B0BPVLXD53,No Description,Visit the ADISA Store
https://www.amazon.in/SFANE-Duffel-Shoulder-Women-Compartment/dp/B07XXDZD5S,Sfane Polyester 23cms Duffle/Shoulder/Gym Bag for Men & Women with Separate Shoe Compartment (Grey),₹427.00,"7,630 ratings",4.3 out of 5 stars,In stock,B07XXFB9CZ,"Sfane Sports Bag practical everyday sizing make it great for hauling just about anything.Big compartments holds Sports Clothing, Gloves, Shaker, Sports ball, Sports Accessories, etc. Or anything that might be wet or soiled. High quality provide years of dependable service. Made in India.",Visit the Sfane Store
https://www.amazon.in/Northzone-Lightweight-Backpacks-Stylish-College/dp/B0BL3QVFX9,Northzone Lightweight school bags Backpacks for Boys Girls Stylish men and women Casual Travel Laptop Bag College office (Black) 40L,₹549,123 ratings,4.0 out of 5 stars,In stock,B0BL3QVFX9,"NORTHZONE BACKPACK If you carry your laptop to and from work, then this laptop bag from Northzone will definitely make travelling easier. Compatibility This backpack can fit a 38.1 cm laptop comfortably. Compartments This bag has three spacious compartments to store the laptop, charger, external devices, and other accessories with ease. Pockets The two mesh pockets on either sides of this black and blue backpack allow you to store a water bottle, ID card and other knick-knacks, so you can access them easily.",Brand: NORTH ZONE
https://www.amazon.in/Arctic-Fox-Liters-Georgia-Backpack/dp/B08FD8Z7BX,Arctic Fox 15 Liters Draw String Bag Lavender Backpack,₹229,"3,390 ratings",4.3 out of 5 stars,In stock,B08FD8Z7BX,No Description,Visit the Arctic Fox Store
https://www.amazon.in/POLESTAR-Backpack-compartment-suitable-warranty/dp/B09YHT5281,"POLESTAR Vintage 15.6 inch 32 LTR Casual Laptop Backpack/Office Bag/School Bag/College Bag/Business Bag/Unisex Backpack, Water Resistant and Light Weight, 1 year Warranty",₹549,"9,028 ratings",3.9 out of 5 stars,In stock,B09YHT5281,No Description,Visit the POLESTAR Store
https://www.amazon.in/Safari-Backpack-Resistant-Polyester-Travelling/dp/B0BNW3MTHS,"Safari Flash Casual Backpack, 26 ltr Water Resistant Travel Bags| Weight Polyester Bagpack for Men and Women, Spacious Shoulder Bag for College, Office, Travelling and Camping",₹799,"2,975 ratings",3.8 out of 5 stars,In stock,B0BNW3MTHS,No Description,Visit the Safari Store
https://www.amazon.in/EUME-Tourismo-Backpack-Resistance-15-6-inch/dp/B0B4JQSMD5,EUME Tourismo 36L Laptop Backpack Bag with 2 Large Compartment for Work Office & Business Travel for Men & Women | Water Resistance | Fit Up to 16 Inch Laptop,"₹2,499",7 ratings,4.4 out of 5 stars,In stock,B0BB2V2NFB,No Description,Visit the EUME Store
https://www.amazon.in/Safari-SAGE18FBBLK-Sage-Formal-Backpack/dp/B097JLZBK3,Sage Formal Backpack - black,"₹3,499",2 ratings,5.0 out of 5 stars,Only 3 left in stock,B097JLZBK3,"For the new age professional, the Safari Sage is the answer to all backpacking needs. The dedicated laptop and tablet sleeves and the Multi Utility Organiser ensures that there is a place for all your essentials. The water resistant and highly durable premium fabric ensures that all your belongings are safe, irrespective of the conditions. The Smart Sleeve allows you to slide your backpack on your luggage for a seamless travel experience. The USB Charging Port keeps you connected always. Its handy Sunglasses Pouch makes sure you never miss a chance to impress!",Visit the Safari Store
https://www.amazon.in/F-Gear-Luxur-Brown-Backpack/dp/B01F7AX9ZA,F Gear Luxur Brown 25 liter Laptop Backpack (2404),"₹1,162.00","16,967 ratings",4.4 out of 5 stars,In stock,B01F7AX9ZA,"A fashionable laptop backpack. This full-featured pack makes space for everything essential with multiple zip pockets on the exterior, plus a ready-to-go interior with padded laptop compartment and other storage solutions. Pattern: Solid. Laptop Size: 16",Visit the F Gear Store
https://www.amazon.in/Arctic-Fox-Backpack-Charging-Laptop/dp/B0BZPT6CSK,Arctic Fox Slope Anti Theft 23 L Backpack with USB Charging Port 15 Inch Laptop Backpack (Marble Black),"₹1,439","4,028 ratings",4.5 out of 5 stars,In stock,B0BZPT6CSK,"Introducing Slope Anti-Theft backpack to secure your essentials. A Multi-functional Laptop bag that has feature-rich updates like Anti-theft, mobile charging port, and a new tech-inspired design making it a prefect bag for laptop to organize your electronics and simplify your life on-the-go..",Visit the Arctic Fox Store
https://www.amazon.in/Backpack-Small-Black-Water-Repellant/dp/B088XB5XY8,"Mi Step Out 12 L Mini Backpack (Small Size, Black, Water Repellant)",₹398.00,"9,471 ratings",4.1 out of 5 stars,In stock,B088XB5XY8,No Description,Brand: MI
https://www.amazon.in/Safari-Laptop-Backpack-Resistant-Fabric/dp/B09B25Z8M2,Safari Quill Large Laptop Backpack 26 Ltrs Water Resistant Fabric - Black,₹899,971 ratings,3.9 out of 5 stars,In stock,B09B25Z8M2,"Safari Quill is a 26 Litres, 2 compartment laptop backpack perfect for daily usage. It has a dedicated tech safe laptop sleeve that can hold upto 17 inch laptop or any smaller ones easily. The laptop sleeve is also fully padded from the bottom protecting your device from any shock or damage. This backpack is especially designed for todays fast paced world, where everything should be compact and lightweight. This backpack is perfect for everyday usage such as college, school, tuitions, or short holiday trips. The front pocket is designed to keep your essentials organized and side mesh pockets are perfect for storing your water bottle and umberella. Made of high grade water resistant polyester fabric, this backpack will last you several trips.",Visit the Safari Store
https://www.amazon.in/ADISA-Casual-Backpack-College-BP046-NAV_Navy/dp/B0BX3QFVSM,ADISA 31 Ltrs Casual Backpack School College Bag Pack,₹399,127 ratings,3.8 out of 5 stars,In stock,B0BXJTF2P6,"Light weight and spacious casual backpack with 2 compartments and 1 front easy-access pocket. The front and back of the backpack are fully padded for cushioning. It has organiser for pens, visiting cards, etc along with space for carrying papers, files, books, etc. It is spacious enough to keep all your stuff. It has provision for holding bottles/unmrella on both sides and has adjustable padded shoulder straps for your comfort. The logo of the bag is Reflective so it will glow when light hits it which is a very important safety feature, specially when on road.",Visit the ADISA Store
