Product URL,Product Name,Product Price,Rating,Number of Reviews,availability,ASIN,Product Description,Manufacturer
https://www.amazon.in/Sirona-Sanitary-Napkin-Diapers-Disposal/dp/B01NAZVN8M,"Sirona Sanitary Disposal Bags | 75 Bags | Pad Disposable Bags for Discreet Disposal of Tampons, Condoms, Diaper, Sanitary Pads, Panty Liner & Personal Hygiene Waste (Green)",₹211.00,"2,922 ratings",4.5 out of 5 stars,In stock,B01NAZVN8M,"Now Bigger & Better! Worried about disposing your Sanitary & Intimate Products? Made in India, 'I Love Clean' by SIRONA are Cute Oxo BioDegradable Disposable Sanitary Bags & are best for Hygienic Disposal of Intimate Care Products (Sanitary Pads, Tampons, Panty Liners, Baby Diapers, Condoms, PeeBuddy) or General products (which need discreet disposal). No More Black Plastic Bags, No More Newspaper. Now use I LOVE CLEAN. The bags are tear resistant and seal perfectly to ensure zero bad odour or leakage.",Visit the Sirona Store
https://www.amazon.in/Number-Backpack-Compartment-Charging-Organizer/dp/B09VTBYNHF,"FUR JADEN Anti Theft Number Lock Backpack Bag with 15.6 Inch Laptop Compartment, USB Charging Port & Organizer Pocket for Men Women Boys Girls",₹679,"4,921 ratings",4.0 out of 5 stars,,B09VTBYNHF,"Stay organized all day with a durable and lightweight backpack from Fur Jaden. This back pack is a stylish and functional accessory for men and women. Can add admiration to an appealing and daring personality with a remarkable aesthetics and functionality. This backpack features an anti-theft design. You can also charge your phone on the go and organize your stuff like pro. Fur Jaden functional back pack is apt to protect your gadgets and belongings from being stolen while you travel, thanks to its special anti-theft design. Now keep your belongings safe with style. The backpack features multiple compartments that you may use for your laptop and other essentials. A remarkable feature of this backpack allows you to charge your phone while you are on the move. With an attached charging dock in the back you may connect a portable power bank with ease. Weighing about 600grams, this backpack is lightweight. The backpack is able to house a laptop of up to 15.6 inches and has seven inner compartments to place your other essentials. Made from durable quality polymer this Fur Jaden back pack is sturdy and reliable. Flaunt this bag with style and low maintenance as this bag is washable. This backpack is also suitable for school or college. The straps are designed to distribute the weight equally on each shoulder preventing any sort of discomfort. Use this back pack for office, college/school or during travels.",Brand: FUR JADEN
https://www.amazon.in/POLICE-Backpack-Casual-College-Polyester/dp/B0BHNJK832,POLICE Backpack for Men Casual Laptop Bag Office/Travel/College 30 Ltr Hedge Polyester - Black,"₹1,399","5,735 ratings",4.1 out of 5 stars,In stock,B0BHNJK832,Backpack,Visit the POLICE Store
https://www.amazon.in/Number-Backpack-Compartment-Charging-Organizer/dp/B09VTBYNHF,"FUR JADEN Anti Theft Number Lock Backpack Bag with 15.6 Inch Laptop Compartment, USB Charging Port & Organizer Pocket for Men Women Boys Girls",₹679,"4,921 ratings",4.0 out of 5 stars,,B09VTBYNHF,"Stay organized all day with a durable and lightweight backpack from Fur Jaden. This back pack is a stylish and functional accessory for men and women. Can add admiration to an appealing and daring personality with a remarkable aesthetics and functionality. This backpack features an anti-theft design. You can also charge your phone on the go and organize your stuff like pro. Fur Jaden functional back pack is apt to protect your gadgets and belongings from being stolen while you travel, thanks to its special anti-theft design. Now keep your belongings safe with style. The backpack features multiple compartments that you may use for your laptop and other essentials. A remarkable feature of this backpack allows you to charge your phone while you are on the move. With an attached charging dock in the back you may connect a portable power bank with ease. Weighing about 600grams, this backpack is lightweight. The backpack is able to house a laptop of up to 15.6 inches and has seven inner compartments to place your other essentials. Made from durable quality polymer this Fur Jaden back pack is sturdy and reliable. Flaunt this bag with style and low maintenance as this bag is washable. This backpack is also suitable for school or college. The straps are designed to distribute the weight equally on each shoulder preventing any sort of discomfort. Use this back pack for office, college/school or during travels.",Brand: FUR JADEN
https://www.amazon.in/Lunars-Bingo-Business-Backpack-Resistant/dp/B08YZ3YZH3,Lunar's Bingo - 48 L Laptop Office/School/Travel/Business Backpack Water Resistant - Fits Up to 15.6 Inch Laptop Notebook with 1 Year Warranty,₹899,"9,898 ratings",3.9 out of 5 stars,In stock,B08YZ3YZH3,No Description,Visit the Lunar's Store
https://www.amazon.in/Lunars-Bingo-Business-Backpack-Resistant/dp/B08YZ3YZH3,Lunar's Bingo - 48 L Laptop Office/School/Travel/Business Backpack Water Resistant - Fits Up to 15.6 Inch Laptop Notebook with 1 Year Warranty,₹899,"9,898 ratings",3.9 out of 5 stars,In stock,B08YZ3YZH3,No Description,Visit the Lunar's Store
https://www.amazon.in/LOOKMUSTER-Waterproof-Backpack-College-Business/dp/B0BS6X5TTQ,LOOKMUSTER Casual Waterproof Laptop Backpack/Office Bag/School Bag/College Bag/Business Bag/Travel Backpack…,₹499,36 ratings,3.8 out of 5 stars,In stock,B0BS6X5TTQ,No Description,Brand: LOOKMUSTER
https://www.amazon.in/F-Gear-Blackhawk-Black-Laptop-Backpack/dp/B07XMRGQCM,F Gear Blackhawk 40 Ltrs Black Laptop Backpack (3178),"₹1,430","1,036 ratings",4.3 out of 5 stars,In stock,B07XMRGQCM,The product will be an excellent pick for you. It ensures an easy maintenance.,Visit the F Gear Store
https://www.amazon.in/Lunars-Comet-Resistant-Casual-Backpack/dp/B07HKDQC5G,Lunar's Comet 35L Water Resistant Travel Bagpack/College Backpack/School Bag/Office Bag/Business Backpack/Daypack for Men and Women with 1 Year Warranty,₹849,"13,542 ratings",4.0 out of 5 stars,In stock,B07HKDQC5G,No Description,Visit the Lunar's Store
https://www.amazon.in/FATMUG-Foldable-Luggage-Storage-Men-Multi-Colour/dp/B07YFP8ZJQ,"FATMUG Polyester Foldable Duffle Travel Bag Luggage For Travel, Packing And Storage - Men And Women - (60 L, Black)","₹1,099.00","1,408 ratings",4.2 out of 5 stars,In stock,B07YFNXC3H,No Description,Visit the FATMUG Store
https://www.amazon.in/POLESTAR-Backpack-compartment-polyester-warranty/dp/B09PLMJ76C,"POLESTAR Ranker 15.6 inch 32 LTR Casual Laptop Backpack/Office Bag/School Bag/College Bag/Business Bag/Unisex Backpack, Water Resistant and Light Weight, 1 year Warranty",₹669,"7,569 ratings",4.1 out of 5 stars,In stock,B09PLMJ76C,"RAIN COVER & PREMIUM FABRIC : POLESTAR RANKER”, Stylish and durable laptop backpack for school /college and travel. Easily accommodate 15.6 inch laptop. Size: 46 cm X 32 cm X 22 cm : 32 liters .We are providing a “ FREE RAIN COVER “ inside a bottom zipper pocket , which makes this An all-weather backpack . This “MAKE IN INDIA” Product features 2 large zippered compartments, 1 vertical long zip pocket at front, one laptop partition, 1 water bottle /umbrella pockets and Organizer Pockets inside. Suitable for casual usage, school / college / office n travel.",Visit the POLESTAR Store
https://www.amazon.in/WALKENT-Waterproof-Laptop-Pockets-Cushioned/dp/B0CC5SRCP8,"WALKENT Waterproof Laptop Bag for Men with Side Bottle Pockets, Cushioned Straps & More P3","₹4,990",,Previous page,Only 4 left in stock,B0CC5SRCP8,"WALKENT Waterproof Laptop Bag for Men with Side Bottle Pockets, Cushioned Straps & More P3",Visit the WALKENT Store
https://www.amazon.in/ZEBRONICS-Compartment-Backpacks-15-6-inch-Polyester/dp/B0C6QNNPMM,"ZEBRONICS Camp1, 14 Liters, 1 Compartment Laptop Backpacks Fit Up to 15.6-inch Laptop, Polyester Fabric, Office Use and Mini Business Travel Bags (Grey)",₹499.00,,Previous page,In stock,B0C6QNNPMM,"ZEBRONICS Camp1, 14 Liters, 1 Compartment Laptop Backpacks Fit Up to 15.6-inch Laptop, Polyester Fabric, Office Use and Mini Business Travel Bags (Grey)",Visit the ZEBRONICS Store
https://www.amazon.in/Half-Moon-Backpack-Spacious-Multiple/dp/B0C23XNRPV,Half Moon Aztec 37L School Bag Class 5-12 | College Bagpack for Men/College Back pack for Women | 15.6 inch Laptop Bag for Men/Backpack for Men | Spacious & Multiple Pockets,₹599,154 ratings,3.7 out of 5 stars,In stock,B0C23XNRPV,No Description,Visit the Half Moon Store
https://www.amazon.in/Wesley-Milestone-Waterproof-Backpack-Business/dp/B07NJRPJ6Q,Wesley Milestone 15.6 inch 25 L Casual Waterproof Laptop Backpack/Office Bag/School Bag/College Bag/Business Bag/Unisex Travel Backpack (Black),₹448.00,"13,088 ratings",4.3 out of 5 stars,In stock,B07NJRPJ6Q,No Description,Brand: Wesley
https://www.amazon.in/ADISA-BP010-Weight-Casual-Backpack/dp/B07MXL986B,ADISA 32 Ltrs Water Resistant Casual Travel Bagpack/College Backpack/School Office Bag for Men and Women,₹499,"4,023 ratings",4.0 out of 5 stars,Available to ship in 1-2 days,B07S6SY5DM,No Description,Visit the ADISA Store
https://www.amazon.in/Number-Backpack-Compartment-Charging-Organizer/dp/B09VTBYNHF,"FUR JADEN Anti Theft Number Lock Backpack Bag with 15.6 Inch Laptop Compartment, USB Charging Port & Organizer Pocket for Men Women Boys Girls",₹679,"4,921 ratings",4.0 out of 5 stars,,B09VTBYNHF,"Stay organized all day with a durable and lightweight backpack from Fur Jaden. This back pack is a stylish and functional accessory for men and women. Can add admiration to an appealing and daring personality with a remarkable aesthetics and functionality. This backpack features an anti-theft design. You can also charge your phone on the go and organize your stuff like pro. Fur Jaden functional back pack is apt to protect your gadgets and belongings from being stolen while you travel, thanks to its special anti-theft design. Now keep your belongings safe with style. The backpack features multiple compartments that you may use for your laptop and other essentials. A remarkable feature of this backpack allows you to charge your phone while you are on the move. With an attached charging dock in the back you may connect a portable power bank with ease. Weighing about 600grams, this backpack is lightweight. The backpack is able to house a laptop of up to 15.6 inches and has seven inner compartments to place your other essentials. Made from durable quality polymer this Fur Jaden back pack is sturdy and reliable. Flaunt this bag with style and low maintenance as this bag is washable. This backpack is also suitable for school or college. The straps are designed to distribute the weight equally on each shoulder preventing any sort of discomfort. Use this back pack for office, college/school or during travels.",Brand: FUR JADEN
https://www.amazon.in/POLICE-Backpack-Casual-College-Polyester/dp/B0BHNJK832,POLICE Backpack for Men Casual Laptop Bag Office/Travel/College 30 Ltr Hedge Polyester - Black,"₹1,399","5,735 ratings",4.1 out of 5 stars,In stock,B0BHNJK832,Backpack,Visit the POLICE Store
https://www.amazon.in/Genie-Glitter-Backpack-Women-compartments/dp/B097JHQH13,"Genie Glitter Backpack for Women - 3 compartments, Laptop Bags for Girls, Stylish and Trendy College Backpacks for Girls, Water Resistant and Lightweight Bags for Office and Travelling Purpose.",Page 1 of 1,913 ratings,4.3 out of 5 stars,Not Available,B097JHQH13,"How do you describe a Perfect Backpack? Spacious enough to carry a lot of stuff, yet Light Weight! Padded Laptop Sleeve to keep it secure and sound. Multiple Pockets to segregate all the items and keep it easily accessible. An Organizer to keep your each and every school supplies in an arranged manner. Side Pocket to keep the Water Bottle. Water Resistant exteriors to keep all your worries at bay and lastly, latest and trendy design to keep those ""Cute Bagpack"" compliment coming in! Yes. We have that Perfect Bag for you, in our Genie store. Bringing you a cute, stylish and trendy design, Genie Glitter School Bag.",Visit the Genie Store
https://www.amazon.in/Lunars-V-Line-Casual-Bagpack-College/dp/B08BTPC7D1,"Lunar's V-Line Backpack for Men, Blue | 35L Water Resistant School Bags for Boys | Stylish, & Durable | College Bags for Men/College Bag for Girls | 1 Yr Warranty",₹799.00,"2,630 ratings",4.1 out of 5 stars,In stock,B08BP5CYDV,No Description,Visit the Lunar's Store
https://www.amazon.in/ZEBRONICS-Compartment-Backpacks-15-6-inch-Polyester/dp/B0C6QNNPMM,"ZEBRONICS Camp1, 14 Liters, 1 Compartment Laptop Backpacks Fit Up to 15.6-inch Laptop, Polyester Fabric, Office Use and Mini Business Travel Bags (Grey)",₹499.00,,Previous page,In stock,B0C6QNNPMM,"ZEBRONICS Camp1, 14 Liters, 1 Compartment Laptop Backpacks Fit Up to 15.6-inch Laptop, Polyester Fabric, Office Use and Mini Business Travel Bags (Grey)",Visit the ZEBRONICS Store
https://www.amazon.in/Backpack-Premium-Business-Scratch-resistant-Multiple/dp/B0BPCLPRHX,Arctic Hunter Backpack for Men Premium Business Backpack Office Travel Laptop Bag with 15.6 Inch Laptop Pocket Water/Scratch-resistant Multiple Pocket Comfortable and Padded Backpack for Men,"₹5,999",150 ratings,4.4 out of 5 stars,In stock,B0BPCLPRHX,No Description,Visit the ah arctic hunter Store
https://www.amazon.in/SKYBAGS-Unisex-Luggage-Duffel-Bag-DFHUS55ONG/dp/B07F342RQD,"Skybags Unisex Polyester Solid Pattern Hustle Df 55 (Orange, Small)","₹1,585.00",314 ratings,4.3 out of 5 stars,In stock,B07F342RQD,"VIP Industries Limited is a renowned brand specializing in the manufacturing of quality bags for a wide range of purposes. With a rich history and extensive expertise in the industry, VIP Industries has established itself as a trusted provider of bags for numerous renowned brands. From travel luggage to stylish backpacks, business cases to trendy handbags, VIP Industries offers a diverse portfolio of products that cater to the diverse needs and preferences of its customers.",Visit the Skybags Store
https://www.amazon.in/Half-Moon-Backpack-Spacious-Multiple/dp/B0C23XNRPV,Half Moon Aztec 37L School Bag Class 5-12 | College Bagpack for Men/College Back pack for Women | 15.6 inch Laptop Bag for Men/Backpack for Men | Spacious & Multiple Pockets,₹599,154 ratings,3.7 out of 5 stars,In stock,B0C23XNRPV,No Description,Visit the Half Moon Store
https://www.amazon.in/Backpack-Laptop-Charging-Resistant-Fabric/dp/B09PYXVKK2,FUR JADEN Anti Theft Backpack 15.6 Inch Laptop Bag with USB Charging Port For Men Women Boys Girls,₹839.00,"13,801 ratings",4.0 out of 5 stars,In stock,B078GLXMDY,"This durable and lightweight backpack from Fur Jaden can keep you sorted throughout the day while also being super stylish, thus making it the perfect modern and functional accessory for any user – male or female. This backpack can be the perfect complement to your bold and charismatic persona, while its multiple inner chambers can hold all your stuff with convenience. Fur Jaden backpacks are young, vibrant and fashionable accessories which are also a symbol of sophistication. This backpack is high on aesthetics as well as on utility and functionality. This unisex backpack from Fur Jaden comes in an anti-theft design which lets you carry your laptop anywhere with confidence. Keep your belongings secure as your score high on the style quotient with this functional backpack. One of the most striking features of this backpack is that it allows you to charge your phone while you are travelling. The charging dock which comes attached to the backpack allows you to connect your portable charger seamlessly for maximum convenience.The material of this backpack from Fur Jaden is water resistant, which keeps any worries about getting it wet in the rain or accidental splashes at bay. Your laptop and every other belonging will stay safe from water as long as you keep them inside your backpack. This backpack from Fur Jaden comes with substantial capacity to accommodate your laptop and other goods with ease. The large capacity of this backpack can store laptops up to a 15.6 inches without any hassle. Weighing in at only 0.7kg, this Fur Jaden backpack with anti-theft feature is a breeze to carry around. Most of the weight you will feel is that of the goods you carry inside, as the backpack does not impose much weight on the user. This multipurpose and water resistant backpack from Fur Jaden can take you from day to night, thanks to its multiple compartments. With 1 main compartment and 7 small, inner pockets, it lets you store all your belongings and keeps them sorted too. Pattern: Solid.",Brand: FUR JADEN
https://www.amazon.in/Asus-BP1504-15-6-inch-Laptop-Backpack/dp/B0895ZZHKK,Asus BP1504 39.62 cm (15.6-inch) Laptop Backpack (Dark Grey),₹819.00,"1,694 ratings",4.2 out of 5 stars,In stock,B0895ZZHKK,"ASUS BP1504 offers stylish, elegant protection for laptops with displays up to 15.6 inch. Elegant and lightweight Cross-dyed Woven Fabric making for a truly beautiful accessory to any NoteBook laptop.",Visit the ASUS Store
https://www.amazon.in/Genie-Clara-Backpack-Women-compartments/dp/B097JJGR1N,"Genie Clara Backpack for Women - 3 compartments, Laptop Bags for Girls, Stylish and Trendy College Backpacks for Girls, Water Resistant and Lightweight Bags for Office and Travelling Purpose.","₹1,279",194 ratings,4.4 out of 5 stars,In stock,B097JJGR1N,"How do you describe a Perfect School Backpack? Spacious enough to carry all the books, yet Light Weight! Padded Laptop Sleeve to keep it secure and sound. Multiple Pockets to segregate all the items and keep it easily accessible. An Organizer to keep your each and every school supplies in an arranged manner. Side Pocket to keep the Water Bottle. Water Resistant exteriors to keep all your worries at bay and lastly, latest and trendy design to keep those ""Cute Bagpack"" compliment coming in! Yes. We have that Perfect Bag for you, in our Genie store. Bringing you a cute, stylish and trendy design, Genie Clara School Bag.",Visit the Genie Store
https://www.amazon.in/bg1905-Capacity-Laptop-Travelling-Backpack/dp/B082MKHDJ1,TSPARK Red Lemon bg1905 15.6 inch 35 LTR Capacity Laptop Bag for Men Travelling Hiking Backpack for Men and Women,"₹2,949",93 ratings,4.2 out of 5 stars,In stock,B082MKHDJ1,No Description,Brand: TSPARK
https://www.amazon.in/Lavie-Womens-Ushawu-Satchel-Handbag/dp/B0B6RY5TX5,Lavie Women's Ushawu Satchel Bag | Ladies Purse Handbag,"₹1,249","6,822 ratings",4.1 out of 5 stars,In stock,B0B6RY5TX5,No Description,Visit the Lavie Store
https://www.amazon.in/Wildcraft-Hopper-Laptop-Backpack-Blue/dp/B07YNL6H8H,Wildcraft Hopper 1.0 Laptop Backpack 24L (Blue),"₹1,390",8 ratings,4.5 out of 5 stars,In stock,B07YNL6H8H,This Laptop Backpack ha capacity of 24 L. This comes in blue colour.,Brand: Wildcraft
https://www.amazon.in/Leatherette-Casual-Laptop-Backpack-Pocket/dp/B09MJBFKWH,Fur Jaden Brown Leatherette Anti Theft Casual Laptop Backpack with 15.6 Inch Laptop Pocket,"₹1,769.00","1,648 ratings",4.2 out of 5 stars,In stock,B07LBMV4NR,No Description,Brand: FUR JADEN
https://www.amazon.in/Number-Backpack-Compartment-Charging-Organizer/dp/B09VTBYNHF,"FUR JADEN Anti Theft Number Lock Backpack Bag with 15.6 Inch Laptop Compartment, USB Charging Port & Organizer Pocket for Men Women Boys Girls",₹679,"4,921 ratings",4.0 out of 5 stars,,B09VTBYNHF,No Description,Brand: FUR JADEN
https://www.amazon.in/Lavie-Sport-Chairman-Backpack-Leatherette/dp/B0BYCW4GDH,Lavie Sport Chairman Backpack with Laptop Sleeve | Premium Leatherette Business Backpack for Men & Women | Durable Office Bag for Notebook/MacBook,₹849,"1,256 ratings",4.0 out of 5 stars,In stock,B0BYCW4GDH,No Description,Visit the Lavie Sport Store
https://www.amazon.in/AirCase-Messenger-Detachable-Compartments-Repellent/dp/B0B74Z4F6P,"AirCase Premium Messenger Bag fits Upto 14.1"" Laptop/MacBook with Handles & Detachable Shoulder Strap |Multiple Spacious Compartments | 2 in 1 Usage | Water Repellent Durable Polyester (Grey)",₹529.00,67 ratings,3.5 out of 5 stars,In stock,B0B74Z4F6P,No Description,Visit the AirCase Store
https://www.amazon.in/Storite-Laptop-Briefcase-Messenger-Bag/dp/B08VWF41VX,"Storite PU Leather 14 Inch Laptop Shoulder Messenger Sling Office Business Travel Bag for Men & Women (Brown, 40cm x 29cm x 6cm)",₹999.00,430 ratings,3.7 out of 5 stars,In stock,B08VWF41VX,No Description,Brand: Storite
https://www.amazon.in/Glowic-Hopping-Shoulder-Handbags-WBAG-34/dp/B09HHNZ47K,"Glowic Hopping Grocery, Travel, Beach | Shoulder Handbags Women, College Bags for Girls Stylish Trendy(WBAG-34) (Multi Colour)",₹459,432 ratings,3.7 out of 5 stars,In stock,B09HHNZ47K,"GLOWIC presents an range of chic, stylish and classy bags. Perfect Look: Designed for the modern woman, we use a variety of trendy and traditional prints that make you and your bag stand out in the crowd. Colourful: Classic colour combinations as well as mix and match of hip patterns make these bags ideal for any occasion. Occasion: be it work, college,travel, event or a party, there is a perfect bag for everything and everyone. Long Lasting: Comfortable and Spacious, light to hold and long lasting, our line of fashionable sling bags and totes are a must have in any wardrobe Available in beautiful prints, eye catching embroidery and brilliant colours, our bags complement your clothes and accentuate your accessories.Available in beautiful prints, eye catching embroidery and brilliant colours, our bags complement your clothes and accentuate your accessories.",Visit the Glowic Store
https://www.amazon.in/uppercase-Professional-Backpack-resistant-sustainable/dp/B0BWRLJ2BH,"uppercase Apex Professional Laptop Backpack (15.6 Inch) 3x more water resistant sustainable bags with rain proof zippers for Men, Women, Boys and Girls, 750 Days warranty","₹1,800",66 ratings,4.3 out of 5 stars,In stock,B0BWRLJ2BH,No Description,Visit the uppercase Store
https://www.amazon.in/Gear-Firefly-Laptop-Rucksack-Liters/dp/B074DWN7NS,"F Gear Firefly V2 Laptop Rucksack 40 Liters (Navy blue, Yellow) Sch Bag","₹1,749.00",126 ratings,4.3 out of 5 stars,In stock,B074DWN7NS,"This bag is a companion you will love to have along anywhere on your trip. Countered Mesh Back Support improves your comfort with easy air flow. It has an In-Built Laptop Sleeve. And the best part, its not just Sturdy but Light Weight. It has three compartments, with two pocket in the front and two small pockets on the Hip Belt on either side. Compression belts with ice axe holder loops on either side along with bottle pouch completes the sides. The back strap can be adjusted both from the top and bottom which enables a good fit for maximum comfort. Chest belt, Hip Belt and Finger Loops completes the picture. Travel ID organizer Amazing backpack in amazing colors.",Visit the F Gear Store
https://www.amazon.in/Gear-Colorado-Orange-Laptop-Backpack/dp/B097K6KD7W,F Gear Colorado Grey Orange 39 Ltrs Laptop Backpack (3814),₹895,208 ratings,4.2 out of 5 stars,Only 3 left in stock,B097K6KD7W,F Gear presents gigantic laptop backpack blends style and functionality. It comes with substantial capacity to accommodate your laptop and several other essentials with ease. This bag does way more than just look good. It provides extra protection for all your valuable devices. The dimensions of the bag are - 34 x 22 x 52 with a capacity of 39 L. To describe it briefly here are the following points: 1. This backpack is made of polyester fabric and is treated to make it water-resistant. 2. This backpack comes with 2-main zippered compartment with an inside sleeve compatible for laptop. 3. This backpack has a front compartment with an organizer. 4. This backpack comes with one zippered front pocket & one quick access mesh zippered. 5. This backpack is equipped with thick padding with anti-sweat breathable air mesh & adjustable padded shoulder straps for extra comfort. 6. Apart from this it has world’s best Japanese brand YKK zippers and sliders. 7. This backpack has two mesh pockets on both sides. 8. Comes with the F Gear promise of quality and durability.,Visit the F Gear Store
https://www.amazon.in/ADISA-Laptop-Backpack-Office-College/dp/B0BXQD8DZX,ADISA Large Laptop Backpack Office Bag College Travel Back Pack with USB (Grey),₹599.00,81 ratings,3.9 out of 5 stars,In stock,B0BXQD8DZX,"High Quality large and spacious laptop backpack with 1 main laptop compartment and 1 front easy-access pocket. It is ideal for carrying laptop inside with padding for safety and space for laptop accessories like charger, etc. It also has organiser for pens, visiting cards, etc along with space for carrying papers, files, etc. It has provision for holding bottles on one side and has USB charging slot on the other side. It has padded shoulder straps for your comfort.",Visit the ADISA Store
https://www.amazon.in/WALKENT-Waterproof-Laptop-Pockets-Cushioned/dp/B0CC5SRCP8,"WALKENT Waterproof Laptop Bag for Men with Side Bottle Pockets, Cushioned Straps & More P3","₹4,990",,Previous page,Only 4 left in stock,B0CC5SRCP8,"WALKENT Waterproof Laptop Bag for Men with Side Bottle Pockets, Cushioned Straps & More P3",Visit the WALKENT Store
https://www.amazon.in/Backpack-Business-Backpacks-Charging-Resistant/dp/B094DGSWH3,"FUR JADEN Travel Laptop Backpack, Business Backpacks with USB Charging Port, Water Resistant College School Computer Bag for Men & Women Fits Under 15.6 inch Laptop and Notebook",₹949,481 ratings,4.3 out of 5 stars,In stock,B094DGSWH3,No Description,Brand: FUR JADEN
